news_title,news_content,published_date
"'ML 28승 위엄은 어디로' 콜어빈 4실점 부진, 'K머신' 앤더슨은 조기강판 '첫 등판 너무 긴장했나' [인천 현장]","[스타뉴스 | 인천=안호근 기자] 현역 메이저리거의 KBO리그 진출 소식이 야구계를 놀라게 했다. 그러나 1선발의 막중한 책임감이 무겁게 느껴진 탓일까. 기대 만큼이나 걱정을 남기며 첫 등판을 마무리했다. 콜 어빈(31)은 22일 인천 SSG랜더스필드에서 열린 SSG 랜더스와 2025 신한 SOL뱅크 KBO리그 원정 개막전에 선발 등판해 2016년 메이저리그(MLB) 신인 드래프트에서 5라운드 지명을 받을 정도로 기대를 모았던 어빈은 2019년 필라델피아 필리스에서 빅리그에 데뷔해 6시즌 통산 134경기에서 28승 40패, 평균자책점(ERA) 4.54의 기록을 남겼다. 더 놀라운 점은 지난해까지 빅리그에서 활약하던 투수였다는 점이다. 그동안 많은 빅리거들이 KBO리그를 찾았지만 이미 전성기가 지난 선수들이 대다수였다는 점을 고려하면 어빈을 향한 기대감이 남다를 수밖에 없었다. 1회말 최지훈을 삼진으로 돌려세우며 시작한 어빈은 정준재에게 볼넷을 내줬지만 기예르모 에레디아를 3루수 파울 플라이, 한유섬에게 시속 152㎞ 몸쪽 높은 코스 직구를 뿌려 루킹 삼진으로 이닝을 마무리했다. 2회 투수가 뼈아팠다. 첫 타자 이지영에게 몸에 맞는 공을 허용한 어빈은 박성한의 타석에서도 제구가 안정을 찾지 못했고 오른 손등을 맞히는 공을 던졌다. 박성한은 한참 동안 타석에서 쓰러져 통증을 호소했고 어빈도 당혹감을 감추지 못했다. 간신히 몸을 일으켜 1루로 향하는 박성한을 향해 사과의 표시를 전했으나 쉽게 내보낸 주자 2명은 치명타로 돌아왔다. 하재훈에게 중전 안타를 맞고 선취점을 내준 어빈은 고명준에게도 비슷한 코스의 안타를 맞았다. 또 한 점을 내줬다. 최지훈의 중견수 희생플라이 때에도 아웃카운트 하나를 더했지만 추가 실점은 막지 못했다. 순식간에 0-3으로 점수 차가 벌어졌다. 3회 안타 2개를 맞고도 2사 1,3루에서 하재훈을 헛스윙 삼진으로 돌려세우며 위기를 넘긴 어빈은 4회에도 실점 없이 이닝을 마쳤다. 4회말 타선의 득점 지원 속에 역전에 성공해 승리 요건을 손에 넣을 것처럼 보였으나 다시 흔들렸다. 5회초 다시 마운드에 오른 어빈은 선두 타자 기예르모 에레디아와 한유섬에게 연달아 중전 안타를 맞았고 무사에서 이지영의 희생번트에 이어 박성한의 유격수 땅볼 때 동점을 허용했다. 5이닝을 버티긴 했으나 92구를 던지는 동안 7피안타 3사사구(1볼넷, 2死구) 6탈삼진 4실점으로 아쉬운 성적을 냈다. 패스트볼은 포심(32구)과 투심(40구) 모두 최고 시속 152㎞를 기록했고 스위퍼(7구)와 커브(6구), 슬라이더와 체인지업(이상 3구), 커터(1구)까지 섞으며 다양한 구종을 뽐냈고 탈삼진 능력도 뽐냈지만 SSG 타자들을 압도하지 못하며 이승엽 감독의 눈도장을 찍지 못했다. '탈삼진 머신' 앤더슨도 기대를 밑도는 아쉬운 투구로 시작했다. 앤더슨은 지난해 24경기 115⅔이닝 동안 탈삼진 무려 158개를 기록하는 괴력을 뽐내며 11승 3패, 평균자책점(ERA) 3.89로 맹활약한 뒤 총액 120만 달러에 SSG에 잔류했다. 미치 화이트가 부상으로 이탈한 가운데 1선발의 중책을 안고 개막전 선발로 등판했으나 기대 이하였다. 첫 이닝은 최고 시속 154㎞를 뿌리며 삼진을 잡아내 산뜻하게 출발해 1이닝을 깔끔히 막아냈고 2회엔 삼자범퇴로 투구수도 아꼈다. 그러나 3회 볼넷에 이어 김재환에게 우측 펜스까지 향하는 대형 2루타를 맞고 1실점했다. 3-1로 리드를 안고 있었기에 여유가 있었음에도 두산 타자들을 쉽게 잠재우지 못했다. 4회 강승호에게 선두 타자 볼넷을 내준 뒤 아웃카운트 2개를 잡아냈으나 박준영에게 우전 안타로 1실점, 정수빈에게 볼넷을 허용한 뒤 2사 1,2루에서 김민석에게 우측 방면 3루타를 맞고 3-4 역전을 허용했다. 3⅔이닝 동안 88구를 던져 4피안타 4볼넷 4탈삼진 4실점하며 5회도 채우지 못하고 강판됐다. 속구 최고 구속은 154⅔에 달했으나 제구에서 아쉬움을 보였다. 56구나 던진 속구 중 스트라이크로 기록된 건 30구에 불과할 정도로 제구가 흔들렸다. 특히나 9번 타자 정수빈에게 연달아 볼넷을 내준 뒤 모두 득점을 허용한 것이 뼈아팠다.",2025-03-22
"최정이 불길함을 느낀 날, 사고가 터졌다… 이숭용 낙담하지는 않는다, SSG 미래에 기대를 건다","[스포티비뉴스=인천, 김태우 기자] ""오늘 경기 할 수 있을까요?"" 3월 17일 광주-기아챔피언스필드에서 열릴 예정이었던 KIA와 SSG의 시범경기 마지막 2연전 첫 경기를 앞두고 많은 관계자들은 '취소'를 예감하고 있었다. 코칭스태프와 선수들도 예외는 아니었다. 이날 광주 지역은 오후 3~4시까지 체감 온도가 섭씨 5도 이하에 머물렀다. 하필이면 야간 경기 적응 대비로 개시 시간을 오후 6시로 잡아놓은 날이었다. 이범호 KIA 감독은 ""날이 좋을 줄 알고 6시로 잡았는데…""라며 추운 날씨에 걱정을 드러냈다. 경기장에 도착한 SSG 선수들의 의견도 다르지 않았다. 김성현과 캐치볼을 하던 최정은 ""오늘 경기 할 수 있을까요?""라고 걱정을 드러냈다. 산전수전을 다 겪은 이 베테랑 또한 이날은 경기를 할 수 있는 날씨가 아니라는 것을 직감하고 있었다. 해가 떠 있을 때는 그래도 낫지만, 해가 완전히 지는 야간 경기는 하기 어려웠다. 최정은 평소보다 더 많은 캐치볼을 하고 훈련에 들어갔다. 이날 경기는 한파로 생각보다 일찍 취소됐다. 하지만 SSG 선수들은 경기장에서 훈련을 소화했다. 훈련을 시작한 시점에는 경기 취소가 결정되지 않았고, 이왕 경기장에 나온 김에 가볍게 몸을 풀고 들어가자고 했다. 그러나 최정이 이날 다쳤다. SSG는 최정이 17일 경기에 앞서 수비 훈련을 하다 오른쪽 햄스트링을 다쳤다고 공식 발표했다. 18일과 19일 두 차례 검진을 받았는데 모두 부분 손상(그레이드 1) 진단을 받았다. 다행히 장기 결장을 요구하는 수준의 부상은 아니다. SSG는 ""통증은 가라앉은 상태""라고 부연했다. 하지만 개막 엔트리 승선은 불발됐고, 3월 말 재검진 일정이 잡혀 있다. 재검진을 받으면 정확한 재활 기간을 알 수 있을 전망이다. 빠르면 4월 초 복귀도 가능하다는 희망적인 분석도 있지만, 모든 것은 예상일 뿐이다. 긍정적인 시나리오, 부정적인 시나리오가 모두 있다. 가뜩이나 외국인 에이스로 기대를 모았던 미치 화이트가 캠프 도중 햄스트링 부상으로 빠져 전력 손실이 큰 SSG다. 캠프 성과가 좋아 시즌 초반부터 달려보고자 했던 계획에 노란불이 켜졌다. 그런데 여기에 팀의 간판 타자이자 팀에서 가장 좋은 득점 생산력을 자랑하는 최정까지 빠지면서 시즌 초반 레이스가 힘겨워졌다. 최정의 상태는 심각한 것은 아니다. 선수가 느끼는 불편함이 크지는 않다. 3월 말 예정된 재검진에서 괜찮다는 판정이 내려지면 기술 훈련과 퓨처스리그 1~3경기를 치르고 올라올 수 있다. 빠르면 4월 첫째주 복귀가 가능하다. 다만 이숭용 감독은 재발이 우려되는 부위인 만큼 최대한 완벽하게 몸을 만든 뒤 복귀를 시킨다는 계획이다. 이숭용 SSG 감독은 22일 인천SSG랜더스필드에서 열릴 예정인 두산과 시즌 개막전을 앞두고 최정에 대해 ""나는 최대한 완벽하게 천천히 오는 게 더 좋을 것이라 생각한다. 나도 현역 시절에 당해봤지만 마음이 급해서 빨리 오면 또 다른 부위에 (무리가) 오는 경우가 많더라""면서 ""정이가 또 방에 찾아와서 '죄송합니다, 책임감을 많이 느낍니다'라고 이야기하는데 완벽하게 천천히 돌아왔으면 좋겠다. 와서는 이제 아프면 안 되는 것""이라고 인내할 뜻을 드러냈다. 한편 최정의 빈자리는 올해 다방면에서 활용하며 최대한 많은 출전 경기 수를 챙겨준다는 구상을 한 2년 차 내야수 박지환이 당분간은 주로 메울 가능성이 높다. 이숭용 감독은 올 시즌을 앞두고 최정이 지명타자로 뛸 때는 3루, 박성한의 휴식 시간이 필요할 때는 유격수로 박지환을 투입한다는 구상을 가지고 있었다. 지명타자, 그리고 간혹 우익수 출장까지 배제하지 않은 상황이었다. 다만 최정의 부상으로 당분간 박지환의 포지션은 3루로 굳어질 가능성이 높아졌다. 이 감독도 박지환의 성장세에 주목하며 큰 기대를 걸었다. 이 감독은 ""정이가 부상을 입은 것은 제일 안타까운 일이다. 어떻게 보면 승패와 직결된 부분""이라면서도 ""그래도 긍정적으로 생각하는 것은 박지환이 가을 캠프 때부터 3루 수비를 계속 준비해 왔다. 빛을 발하지 않을까 기대를 하고 있다. 지환이도 준비를 잘 했다. 또 공수에 주루까지 할 수 있는 친구다. 좋은 기회니 본인이 잘 잡을 것이라 생각한다""고 말했다. 현재 SSG는 화이트와 최정이 모두 빠진 상태다. 이 감독은 타선에서는 하재훈, 마운드에서는 김건우에게 기대를 걸었다. 하재훈은 미국 캠프 당시 가장 좋은 타격감을 보인 선수였다. 오키나와 2차 캠프에서 부상을 당해 조기 귀국했지만 다시 타격감을 끌어올리는 과정이다. 김건우의 경우는 당장은 불펜에서 활용하지만, 화이트가 복귀하는 시점에서는 선발도 고려할 것이라 이야기했다. 김건우의 컨디션, 5선발 경쟁 자원들의 컨디션을 두루 보고 결정한다는 계획이다. 이 감독은 ""김건우는 (지금은) 최대한 앞에 붙일 것이다. 원 플러스 원 개념이다. 건우는 화이트가 돌아오면, 구위가 좋고 괜찮으면 선발로도 고민을 하고 있다. 언젠가는 선발에 들어가게끔 만들 것이다. 충분히 그런 자질이 있다고 본다. 다만 지금은 팀 사정상 불펜 쪽에 조금 비중을 두고 있는데 화이트가 돌아오면 조금씩 바뀔 수 있다""고 예고했다. 한편 SSG는 개막전을 맞이해 최지훈(중견수)-정준재(2루수)-에레디아(좌익수)-한유섬(지명타자)-이지영(포수)-박성한(유격수)-하재훈(우익수)-고명준(1루수)-박지환(3루수) 순으로 타순을 짰다. 선발은 드류 앤더슨이다. 이 감독은 앤더슨의 투구 수로 90개 정도까지 생각한다면서, 경기 양상에 따라 이기고 있으면 필승조 투입이 빨라질 수 있다고 예고했다.",2025-03-22
"'495홈런' 리빙 레전드 충격 개막전 불발→""빠르면 4월 둘째 주 복귀 전망"" 사령탑 전화위복 기대 [문학 현장]","(엑스포츠뉴스 문학, 김근한 기자) SSG 랜더스 이숭용 감독이 베테랑 내야수 최정 부상 이탈에 최대한 긍정적인 시선을 보냈다. SSG는 22일 인천 문학SSG랜더스필드에서 2025 신한 Sol 뱅크 KBO리그 두산 베어스와 정규시즌 개막전 치른다. 이날 오전 10시 기준으로 2만 3000석 전 좌석이 매진됐다. 이날 SSG는 최지훈(중견수)-정준재(2루수)-에레디아(좌익수)-한유섬(지명타자)-이지영(포수)-박성한(유격수)-하재훈(좌익수)-고명준(1루수)-박지환(3루수)으로 이어지는 선발 타순을 앞세워 두산 선발 투수 어빈과 상대한다. SSG 선발 투수는 앤더슨이다. SSG는 핵심 타자 최정 없이 개막 시리즈에 임한다. 최정은 햄스트링 부상으로 이탈했다. SSG 구단은 지난 20일 ""최정 선수가 지난 17일 광주-KIA챔피언스필드에서 수비 훈련 과정에서 우측 햄스트링 쪽에 약간의 불편함을 느꼈다. 이에 구단은 18일과 19일 두 차례 검진을 진행했고, 검진 결과 우측 햄스트링 부분손상(Grade 1) 진단을 받았다""고 밝혔다. 최정은 3월 말 재검진을 통해 복귀 시기를 결정할 예정이다. 최정은 지난해 4월에는 이승엽(현 두산 베어스 감독)이 보유하고 있던 개인 통산 홈런 1위 기록(467개)을 경신했다. 통산 495홈런으로 500홈런까지 단 5개만을 남겨뒀다. 이숭용 감독은 22일 경기 전 취재진과 만나 ""최정 선수는 농담 반 진담 반으로 우리 팀 50%를 차지하니까 아쉬움이 크다""라며 ""그래도 빠르면 4월 둘째 주, 셋째 주 정도에 돌아올 것으로 본다. 그때까지 팀 순위를 잘 유지하고 있으면 더 탄력받을 요소가 되지 않을까 싶다""며 ""선수 본인은 통증이 심하지 않다고 하는데 최대한 완벽하게 천천히 오는 게 더 좋다고 생각한다. 방에 찾아와서 죄송하다고 또 말하는데 돌아와서 안 아픈 게 가장 중요하다. 그래도 최정 부상으로 다른 선수들이 더 경각심을 느끼면서 더 팀을 위해 뛸 것으로 최대한 긍정적인 생각을 하려고 한다""고 전했다. 최정의 빈자리는 젊은 피 박지환이 채운다. 박지환은 지난해 가을부터 3루 수비 훈련에 집중했다. 이 감독은 오히려 박지환의 잠재력을 꽃피울 기회라고 바라본다. 이 감독은 ""최정 선수가 다친 건 안타깝지만, 지난해부터 3루 수비를 계속 준비한 박지환 선수가 빛을 발할 수 있을지 않을까 기대하는 것도 있다. 공·수·주 두루 다 좋은 친구라 본인이 기회를 잘 잡을 것으로 기대한다""고 강조했다. SSG는 개막전 상대 선발 콜 어빈과 맞붙는다. 이 감독은 전력분석 파트와 상의해 어빈을 공략할 방향성을 잡았다. 이 감독은 ""상대 선발이 되게 치기 까다로운 스타일이다. 좌완인데 3루 쪽을 밟고 던져서 우타자 몸쪽이 굉장히 위력적이다. 좌타자에게도 그렇다. 영상을 봤을 때는 차라리 안 좋은 타구가 나오는 몸쪽을 버리고 조금 더 먼쪽을 보고 공략하는 게 낫지 않을까 싶다. 선수들도 그 부분을 잘 인지할 것""이라고 바라봤다. SSG 선발 투수 앤더슨은 90구 정도 투구수가 예정됐다. 스윙맨 역할을 맡을 좌완 김건우가 빠르게 마운드로 올라갈 수 있다. 이 감독은 ""앤더슨 선수는 90구 정도 생각 중이다. 만약 이기는 상황이라면 불펜을 빨리 움직일 수 있다. 김건우 선수가 어느 타이밍에 나갈지가 정말 중요하다. 최대한 앞에 붙이는 1+1 개념이다. 노경은, 김민, 조병현 등 필승조 투수들도 큰 문제 없이 개막전에 임할 것""이라고 힘줘 말했다. 사진=엑스포츠뉴스 DB",2025-03-22
"'육성총괄 추신수의 끊임없는 수다' 랜더스필드 큰형님의 변신! '1,2,3군 모든 선수들 책임진다'[인천현장]","[인천=스포츠조선 송정헌 기자] 어제의 큰형님이 이제는 선수들을 돕는 보좌역으로 돌아왔다. 22일 인천 SSG랜더스필드에서 KBO리그 개막전 SSG와 두산의 경기가 열린다. 랜더스필드는 3년 연속 개막전 매진을 기록했다. SSG는 두산과 개막 2연전을 갖고 올 시즌 페넌트레이스를 시작한다. 경기를 앞두고 그라운드에서 선수들의 훈련을 지켜보는 이숭용 감독 곁에는 추신수가 있었다. 추신수는 지난 시즌을 마치고 현역 선수 은퇴를 했다. 2021년 KBO리그에 합류한 추신수는 인천에서 4년 동안 활약했다. 추신수는 올 시즌 SSG 구단주 특별보좌역 겸 육성총괄을 맡았다. SSG 선수단 전반적인 일에 신경을 쓰고 있다. 1군 선수들뿐만 아니라 2, 3군 선수들의 컨디션까지 챙기며 구단에 도움을 줄 수 있도록 주력하고 있다. 추신수는 개막전을 앞두고 랜더스필드에 나타났다. 개막전을 앞두고 선수들의 컨디션을 꼼꼼하게 체크했다. 외야에 나가 선수들의 공을 줍기도 했다. 선수들을 위해 배팅볼도 던져주고 타격에 대한 조언도 아끼지 않았다. 추신수 육성총괄은 이숭용 감독과 한참 동안 대화를 나눴다. 베테랑 추신수는 메이저리그에서 10년 이상 선수로 뛰면서 선진 야구에 대한 풍부한 지식과 경험을 가지고 있다. 어린 선수들에게 많은 도움을 줄 수 있다. 지난해까지 함께 뛰었기에 코치들이 할 수 없는 큰형 역할도 할 수 있다. 베테랑이 후배들의 성장을 위해 다시 나타났다. 추신수 총괄의 끊임없는 수다가 선수들에게 많은 도움을 줄 것이다.",2025-03-22
"""정아, 아프면 안 되니까 천천히 와"" 2년차 감독의 당부, 韓 495홈런 3루수의 건강한 복귀를 응원하다 [MD인천]","[마이데일리 = 인천 이정원 기자] ""정이가 완벽하게 낫고 천천히 돌아왔으면 좋겠다."" 이숭용 감독이 지휘하는 SSG 랜더스는 22일 인천 SSG랜더스필드에서 2025 신한 SOL Bank KBO리그 두산 베어스와 개막전을 치른다. 경기 시작 4시간 전에 일찌감치 23,000석이 완판된 가운데 SSG는 2021년부터 이어져 온 개막전 연승 숫자를 '5'로 늘리고 싶어 한다. 하지만 시즌 시작을 베스트 라인업으로 하지 못한다. 미치 화이트가 빠졌고, 최근에는 최정이 햄스트링 부상을 입어 개막 엔트리에 이름을 올리지 못했다. SSG 관계자는 최근 ""최정 선수는 17일 광주 KIA챔피언스필드에서 수비 훈련을 하다가 우측 햄스트링 쪽에 약간의 불편함을 호소했다. 18일과 19일 두 차례 검진을 진행했다. 검진 결과 우측 햄스트링 부분 손상(Grade 1) 진단을 받았다""라며 ""현재 통증은 가라앉은 상황이나 정확한 복귀 시기는 3월 말 재검진을 통해 알 수 있다. 검진 시 상태가 괜찮으면 2군 경기를 거쳐 1군에 복귀할 예정이다""라고 전했다. 경기 전 만난 이숭용 감독은 ""아쉬움은 있다. 농담반 진담반으로 최정은 우리 팀 전력의 50% 이상을 차지하는 선수다. 그렇지만 긍정적으로 생각하려 한다. 화이트나 정이 모두 4월 둘째주 혹은 셋째주 복귀를 생각하고 있다""라고 말했다. 이어 ""부상자들이 돌아올 때까지 우리가 순위 유지를 잘 한다면, 돌아온 후에 더 탄력을 받을 것이다. 또한 엔트리에 든 선수들 모두 준비를 잘했다. 믿고 기회를 주려고 한다""라고 덧붙였다. 최정은 전날 이숭용 감독을 찾아가 빨리 돌아오겠다는 의사를 전했다. 그러나 이숭용 감독은 ""완벽하게, 천천히 돌아오는 게 더 좋다고 생각한다. 나도 현역 시절에 부상을 당해봤지만 마음이 급해 빨리 오면 또 다른 부상이 찾아올 수 있다. 어제도 찾아와서 '죄송합니다. 책임감 많이 느낍니다'라고 했는데, 완벽하게 천천히 돌아왔으면 좋겠다. 이제 아프면 안 된다""라고 격려했다. SSG는 최지훈(중견수)-정준재(2루수)-기예르모 에레디아(좌익수)-한유섬(지명타자)-이지영(포수)-박성한(유격수)-하재훈(우익수)-고명준(1루수)-박지환(3루수)으로 나선다. 하재훈의 활약을 기대한 이숭용 감독은 ""비시즌 하재훈의 폼이 좋았다. 부상을 당한 후 미국에서만큼의 퍼포먼스가 나오지 않고 있지만 조금씩 좋아지고 있다""라고 기대했다. 선발 투수는 드류 앤더슨이다. 지난 시즌 중반 로버트 더거를 대신해 SSG 유니폼을 입은 앤더슨은 24경기(115⅔이닝) 11승 3패 평균자책 3.89를 기록했다. SSG와 재계약에 성공했다. 개막전 선발까지 낙점됐다. 이숭용 감독은 ""90구 정도 생각하고 있다""라고 이야기했다.",2025-03-22
"박지환, '최정 공백' 메꾼다…이숭용 감독 ""작년부터 3루수 준비""","(인천=뉴스1) 문대현 기자 = 2025시즌 개막전을 앞둔 SSG 랜더스가 부상자 최정(38)의 공백을 2년 차 유틸리티 야수 박지환(20)으로 메꾼다. 이숭용 SSG 감독은 22일 인천 SSG랜더스필드에서 열리는 2025 신한 SOL뱅크 KBO리그 두산 베어스와 홈 개막전을 만나 박지환의 선발 출전을 예고했다. '9번 타자 3루수' 박지환의 선발 출전은 최정의 부상으로 이뤄졌다. 팀의 간판타자인 최정은 지난 17일 시범경기 광주 KIA 타이거즈전을 앞두고 수비 훈련을 하다가 햄스트링(오른쪽 허벅지 뒤 근육)에 불편함을 호소했다. 해당 경기는 한파로 취소됐는데, 추운 날씨에 몸을 움직이다가 근육에 무리가 왔다. 이후 최정은 18일과 19일 두 차례 검진했고, 햄스트링 부분 손상(그레이드 1) 진단을 받았다. 현재 통증은 가라앉았지만, 정확한 복귀 시점은 며칠 후 재검진을 통해 알 수 있을 전망이다. 상태가 호전되더라도 퓨처스(2군)리그 경기를 거쳐 4월 중순에야 1군에 복귀할 전망이다. 이 감독은 ""최정은 팀 전력에 50% 이상을 준비하는 선수다. 감독으로서 아쉽지만, 최대한 긍정적으로 생각하려 한다""며 ""최정이 돌아올 때까지 잘 버티다가 복귀하면 더 탄력을 받고 올라갈 수 있을 것""이라고 말했다. 최정은 전날 숙소에서 이 감독을 찾아가 몸 관리를 제대로 하지 못해 죄송하다며 고개를 숙였다. 그러자 이 감독은 완벽하게 천천히 몸을 만들고 오라고 대답했다. 이 감독은 ""마음이 급해 빨리 복귀했다가 다른 데가 다치는 경우가 있다""며 ""다시 와서 아프면 안 되니, 천천히 잘 회복하고 오라고 했다. 시즌 초 부상 위험이 있으니 다른 선수들도 경각심을 갖고 더 잘 준비하길 바란다""고 당부했다. SSG는 이날 최지훈(중견수)-정준재(2루수)-에레디아(좌익수)-한유섬(지명타자)-이지영(포수)-박성한(유격수)-하재훈(좌익수)-고명준(1루수)-박지환(3루수)으로 선발 라인업을 꾸렸다. 선발투수는 드류 앤더슨이다. 최정을 대신해 3루수로 나설 박지환에 대해 이 감독은 ""3루수 준비를 작년 가을 캠프부터 준비해 왔기에 오늘 빛을 발할 것으로 본다. 주루 능력도 좋은 선수니 잘해서 기회를 잡길 바란다""고 전했다. 한편 SSG랜더스필드의 전 좌석(2만3000석)은 이날 오전 10시 다 팔렸다. 이로써 SSG는 2023시즌부터 3년 연속 개막전 만원 관중을 달성했다. 이 감독은 ""감사하다. 많은 관심에 감독으로서 기분 좋은 부담을 느낀다""며 ""작년에 상대적으로 홈 승률이 안 좋았는데, 올해는 홈에서 더 좋은 퍼포먼스로 관중들의 응원에 보답하겠다""고 강조했다.",2025-03-22
