news_title,news_content,published_date
“이토록 잘하는데 백업이라니”…개막전 승리 이끈 베테랑 오태곤의 ‘품격’,"인천 = 정세영 기자 ""사인을 못 해줄 정도로 팔이 짜릿하네요."" 짜릿한 역전 결승 홈런을 터뜨려 SSG에 개막전 승리를 안긴 베테랑 야수 오태곤(34)의 말이다. 오태곤은 22일 인천SSG랜더스필드에서 열린 2025 신한 쏠(SOL) 뱅크 KBO리그 두산과의 정규시즌 개막전에서 4-5로 뒤진 8회 말 8회 1사 1루에서 대타로 투입됐다. 결정적인 한 방을 터뜨렸다. 오태곤은 볼카운트 1볼-1스트라이크에서 상대 투수 이영하가 몸쪽으로 던진 시속 150㎞짜리 직구를 통타, 좌측 담장을 넘어가는 역전 투런 홈런포로 연결했다. 공이 배트에 맞는 순간, 홈런임을 직감할 수 있었던 초대형 타구였다. 실제 오태곤이 때린 타구는 외야 상단의 그린존 앞에 떨어졌다. 비거리는 110m. 2011년 프로에 데뷔한 오태곤의 데뷔 첫 개막전 홈런이다. 이 한방으로 승부가 갈렸다. SSG는 8회 초 2사 만루에서 등판한 조병현이 8회에 이어 9회를 깔끔하게 무실점으로 틀어막고 기분 좋은 개막전 승리를 챙겼다. 오태곤은 경기 뒤 ""144경기 중 1경기지만, 첫 단추를 잘 끼어 너무 좋게 생각한다. 팀이 이기는 데 큰 보탬이 돼 기쁘다""고 소감을 밝혔다. 이어 그는 ""경기 뒤 6개의 공에 사인을 해야 하는 데, 사인이 안 되더라. 전율이 왔다. 오랜만에 그런 느낌이었다. ‘어 내가 16년 차인데 뭐가 잘못됐다’라는 생각이 들었다""라며 환한 미소를 지었다. 개막전부터 팀에 귀중한 1승을 안긴 오태곤의 올해 역할은 백업 야수. 올핸 외야와 1루를 넘나들 예정이다. 백업이지만, 팀 내 선수 중 가장 컨디션이 좋다. 미국 플로리다와 일본 오키나와로 이어지는 스프링캠프에서 절정의 몸 상태를 자랑했다. 이숭용 SSG 감독도 캠프 기간 ""우리 팀에서 가장 컨디션이 좋은 타자""라고 치켜세울 정도. 오태곤은 올해 시범경기에선 6개의 타점을 쓸어 담으며 존재감을 톡톡히 과시했다. 오태곤은 이를 두고 ""감독님과 코치님이 항상 믿어준다. 팀에 윈윈이 되는 게 저에게 좋은 것 같다""면서 ""솔직히 저도 사람인지라, 아쉬운 생각이 들 때는 있다. 하지만 과거에도 제가 어릴 적, 유망주 시절 그랬던 같다. 나도 어린 선수들처럼 기대받을 때가 있었으니, 이젠 내 역할을 받아들이려고 한다""고 설명했다. 그러면서 오태곤은 ""올핸 개인 욕심은 없다. 팀이 잘 돼야 한다. 지금은 백업으로 뒤에서 출발하고, 선수들이 다쳤을 때나 컨디션 안 좋을 때나 나가지만 팀은 뎁스가 두꺼워야 한다. 팀도 잘 되고, 저도 인정받고 해서 오래오래 야구를 하고 싶다""고 강조했다.",2025-03-22
‘백업’ 오태곤의 짜릿한 대타 역전포··· “손이 떨립니다”[스경X현장],"“손이 떨려서 사인을 못 하겠네요.” 백업으로 시즌을 시작한 오태곤(34)의 짜릿한 한 방이 개막전 승패를 갈랐다. 결승 대타 홈런을 때려낸 오태곤 본인이 가장 놀랐다. SSG의 승리로 경기가 끝난 순간 소름이 확 올라왔다고 했다. SSG가 22일 인천 SSG랜더스필드에서 열린 시즌 개막전에서 두산을 6-5로 꺾었다. 8회까지 4-5로 뒤처지고 있었지만, 1사 1루에서 대타로 나온 오태곤이 이영하를 상대로 역전 투런포를 때렸다. 3구째 복판으로 몰린 150㎞ 직구를 받아쳐 왼쪽 담장을 넘겼다. 오태곤은 “빠른공을 예상하고 타석에 들어섰다. 1-1에서 어차피 직구, 슬라이더니까 방망이 나가다가 슬라이더 걸릴 것까지 생각하고 타이밍을 앞에도 놓고 쳤는데, 생각대로 잘 맞아떨어진 것 같다”고 말했다. 맞는 순간 비거리는 충분하다고 생각했다. 파울 폴 안으로 들어올지, 바깥으로 휘어져 나갈지가 문제였다. 오태곤은 “그 짧은 순간 동안 ‘들어가라, 들어가라’하고 몇 번이나 속으로 외쳤다”고 웃었다. 준비된 한 방이었다. 오태곤은 “감독님께서 경기 후반 대타로 들어갈 거라고 미리 언질을 주셨다. 그게 아니라도 선발로 안 나가는 날은 한 3회부터 더그아웃 뒤에서 몸 풀고 타격연습을 많이 한다. 오늘도 스윙 많이 하고 타석에 들어갔다”고 말했다. 오태곤은 “저뿐 아니다. 후배들한테도 선발로 안 나가는 날은 미리부터 준비하라고 계속 말을 해왔다. 주전들이 야구 하고 있는데, 백업들이 벤치에서 파이팅 많이 한다고 사실 무슨 도움이 되겠느냐”고 했다. 이날도 배팅머신 빠른공으로 계속 방망이를 휘두르면서, 경기 후반을 미리 준비했기 때문에 이영하의 빠른공을 넘길 수 있었다는 설명이다. 오태곤은 지난 시즌 9홈런에 타율 0.275, OPS 0.804를 기록하며 2011년 데뷔 이후 최고의 한 해를 보냈다. 그럼에도 올 시즌 백업 역할을 맡았다. 팀 전반의 ‘리모델링’을 위해 이숭용 감독은 23세 1루수 고명준에게 더 많은 기회를 주기로 했다. 오태곤은 “솔직히 저도 사람인지라 그런(아쉽다는) 생각은 든다”면서도 “오늘 (박)지환이, (박)성한이, (정)준재, (고)명준이 있는 거 보고 우리팀 정말 젊어졌다고 얘기했다. 제 입장에서야 입지가 좁아지는 거지만, 어쩌겠느냐. 저도 예전에 롯데에서 유망주라고 기회 받던 그런 때가 있었던 만큼 받아들이자고 생각했다”고 담담하게 말했다. 그러면서도 “그런 가운데 더 파이팅 내고, 동생들 가르쳐줄 수 있는 게 있으면 더 가르쳐 주려고 한다. (FA로) 돈도 받았으니 돈값도 해야 하고, 감독·코치님께서 항상 믿어주시는 만큼 윈윈이 될 수 있도록 하는 게 저한테도 좋은 것 같다”고 말했다. 프로 15년 만에 개막전 홈런은 처음이다. 비시즌 열심히 준비한 보답을 시즌 첫 경기부터 받았다. 오태곤은 “‘논란의 6인방’이 있지 않았냐”고 운을 뗐다. 오태곤을 포함해 최정, 이지영, 김성현, 한유섬, 김민식 등 베테랑 야수 6명은 1차 스프링캠프를 1군 본진이 있는 미국 플로리다가 아니라 일본 가고시마 2군 캠프에서 치렀다. 베테랑들의 컨디션 관리를 위한 ‘최적의 선택’이라고 설명은 했지만, ‘원 팀’을 해치는 것 아니냐는 비판도 있었다. 오태곤은 “안 믿으실지도 모르겠지만, 미안한 마음도 있었기 때문에 6명이 정말 열심히 했다. 6명이라서 훈련양도 정말 많았다. 특히 (최)정이 형이 대단했다. 후배들한테 ‘정이 형 봐라. 300억 받은 선수가 나이 40에 펑고 하나라도 더 받으려고 하는데, 너희는 더 해야 한다’는 말을 해줬다. 좋은 경험이었던 것 같다”고 말했다. 오태곤은 ‘데뷔 후 최고의 시즌 출발’이라는 말에 “준비는 잘했고, 결과는 이제 하늘만 안다. 개인 욕심은 없다. 팀이 잘돼야 한다. 백업으로 출발하지만, 후배들 부상 당하거나 컨디션 안 좋을 때, 쉬어야 할 때 잘해서 팀도 잘 되고 저도 인정받으면서 야구 오래 하고 싶다. 가늘고 길게라도 좋으니 최대한 오래 유니폼 입고 싶다”고 웃었다. SSG는 오태곤의 한 방을 앞세워 짜릿한 개막전 승리를 거뒀다. 8회 2사 등판한 마무리 조병현이 1.1이닝 무실점으로 승리를 챙겼다. 화제의 외국인 투수 두산 콜 어빈은 5이닝 7피안타 3사사구 4실점으로 호된 신고식을 치렀다. SSG 선발 드류 앤더슨도 3.2이닝 4실점으로 부진했다. 인천 | 심진용 기자 sim@kyunghyang.com",2025-03-22
"한 번의 스윙을 위해, 2시간을 연습했다… 오태곤의 드라마는 그냥 만들어지는 게 아니다","[스포티비뉴스=인천, 김태우 기자] 사실 경기에 있던 시간은 그렇게 길지 않았다. 10분 남짓이었다. 그러나 경기 내내 더그아웃에 있다 10분간 경기에 나선 선수가 극적인 투런포로 팀을 개막전 승리로 이끌었다. 어쩌면 오태곤(34·SSG)은 매번 그런 선수였을지 모른다. SSG는 22일 인천SSG랜더스필드에서 열린 두산과 2025년 정규시즌 개막전에서 4-5로 뒤진 8회 터진 오태곤의 극적인 역전 투런포에 힘입어 6-5로 이기고 기분 좋은 시즌 출발을 알렸다. 경기가 전체적으로 잘 풀리지 않는다는 인상을 주는 경기였지만, 오태곤의 시원한 한 방이 청량제 몫을 하며 경기장 대다수를 메운 홈팬들에게 짜릿한 경험을 선사했다. 이날 오태곤은 선발 명단에서 빠졌다. 선발 1루수는 고명준이었고, 선발 우익수는 캠프부터 뛰어난 타격감을 보여주고 있었던 하재훈이었다. 상대 선발(콜어빈)이 좌완이었음에도 불구하고 벤치에서 시작한 이유다. 역시 캠프에서 화끈한 장타력을 보여준 오태곤이지만, 경기에 나가는 것은 자신이 결정하는 것은 아니었다. 그러나 더그아웃에서 계속 놀고 있었던 것은 아니었다. 유니폼은 마치 경기를 뛰지 않은 듯 깨끗했지만, 3회부터 계속 스윙을 하며 몸을 예열했다. 랜더스필드의 홈 클럽하우스에는 타격 훈련을 할 수 있는 머신이 있다. 굉장히 빠른 공이 나오는 대신 손목이나 손의 부담을 덜기 위해 고무공을 쓴다. 옆에는 티배팅을 할 수 있는 공간도 있다. 오태곤은 선수들과 팬들의 시선이 그라운드로 쏠린 사이, 그 뒷공간에서 언제 찾아올지 모르는 한 번의 스윙을 위해 묵묵히 연습하고 있었다. 오태곤은 경기 후 ""(대타 타이밍은) 그 전에 미리 감독님이 언질을 주셨다. 우리 감독님이 항상 선수들 편에서 먼저 준비하라고 말씀을 해 주신다""고 예정된 대타 출전임을 밝힌 뒤 ""그래서 뒤에서 많이 쳤다. 그다음에 이영하 선수 던지는 것도 많이 보고 그렇게 했던 게 좋은 공부가 되고 준비를 잘 했던 게 좋은 결과로 이어졌다""고 설명했다. 3회부터 계속 준비를 하고 있었다는 게 오태곤의 설명이다. 오태곤은 그것이 효과를 봤다고 했다. 오태곤은 ""여기 백업 선수들에게도 항상 말하는 게 있는데 '너희들이 할 수 있는 것을 치고, 스트레칭을 하고, 뛰고, 부상을 안 당하는 것이 팀에 도움이 된다'고 한다. 그런 시스템이 많이 갖춰진 것 같다""면서 ""머신은 오타니가 던지는 것보다도 더 빠르다. 오늘도 대타를 나갔는데 이영하 선수의 초구 149㎞가 너무 빨라 보이더라. 그런데 저런 것들을 보고 가니까 조금 많이 도움이 됐던 것 같다""고 이야기했다. 오태곤은 ""벤치에 너무 앉아 있으면 몸이 굳으니까 열도 내고, 빠른 공도 보면서 적응도 하고 그렇게 준비를 한다""고 자신의 숙명을 담담하게 이야기했다. 사실 남들 못지않게 준비를 잘 했고, 벤치에서 출발하는 것 자체가 서운할 수밖에 없다. 주전의 기회가 주어지지 않는 게 야속할 법도 하다. 실제 이숭용 감독은 팀의 리모델링을 위해 올해도 주전 1루수로 고명준을 낙점했다. 오태곤은 ""솔직히 나도 사람인지라 그런 생각이 든다""고 인정했다. 하지만 자신도 어릴 때, 유망주 소리를 들을 때 그런 기회를 얻었던 것을 기억하면서 ""나도 저럴 때가 있었으니 받아들이자는 생각을 한다. 오히려 파이팅을 많이 내주고, 벤치에서 괜찮다고 해주고, 애들을 가르쳐 줄 수 있는 부분은 많이 가르쳐준다. 그 속에서 내가 준비를 잘 해서 살아남아야 한다. 돈도 받았으니까 돈값도 해야 하고, 감독님과 코치님이 항상 믿어주시니 그것도 감사해서 많이 도와주고, 팀이 이기는 게 나한테 좋은 것 같다""고 개의치 않았다. 오태곤은 경기 전 느낌을 묻자 ""결과는 하늘이 아는 것""이라고 웃어 넘겼다. 자신은 최선을 다하고, 하늘의 뜻을 기다리겠다는 의미다. 오태곤은 ""열심히 하지 말고 잘하라고 이야기하지 않나. 나도 잘하고 싶다. 준비 과정을 잘 하고 진짜 그라운드에서 열심히 하면 결과는 하늘이 낸다고 생각한다""면서 ""내가 잘한다고 해서 뭔가 잘하면 좋겠지만 지금도 백업에서 출발한다. 애들이 부상을 당했을 때나 컨디션 안 좋을 때, 쉴 때 나가서 뎁스가 두꺼워져야 팀이 좋다. 그렇게 해서 팀도 잘 되고 나도 팀이 좀 인정해 줘서 야구를 좀 오래 하고 싶다. 선배들이 길을 너무 잘 닦아놓으셔서 다 오래 하시더라. 나도 가늘고 길게라도 좋으니 유니폼 최대한 오래 입고 싶다""고 각오를 다졌다. 지금과 같은 활약이라면 충분히 그럴 자격을 증명할 수 있을지 모른다.",2025-03-22
"'대타→역전 투런포 쾅' 오태곤이 끝냈다, '투수 7명 총력전' SSG가 두산 잡았다 [인천 현장리뷰]","[스타뉴스 | 인천=안호근 기자] SSG 랜더스가 한국시리즈를 방불케하는 총력전 끝에 만원관중에게 짜릿한 개막전 승리를 안겼다. 대타 오태곤(34)이 홈런으로 짜릿한 승리를 선사했다. SSG는 22일 인천 SSG랜더스필드에서 열린 두산 베어스와 2025 신한은행 SOL뱅크 KBO리그 개막전에서 8회말 대타 오태곤의 투런 홈런으로 6-5 승리를 챙겼다. SSG는 이날 최지훈(중견수)-정준재(2루수)-기예르모 에레디아(좌익수)-한유섬(지명타자)-이지영(포수)-박성한(유격수)-하재훈(우익수)-고명준(1루수)-박지환(3루수) 순으로 타순을 꾸렸다. 두산 타선은 이날 김민석(좌익수)-김재환(지명타자)-양의지(포수)-제이크 케이브(우익수)-강승호(3루수)-양석환(1루수)-오명진(2루수)-박준영(유격수)-정수빈(중견수)으로 맞섰다. 기대를 모았던 외국인 1선발의 대결은 싱겁게 끝났다. 지난해까지 메이저리그에서 뛰었던 콜 어빈이 5이닝 동안 92구를 던져 7피안타 3사사구 6탈삼진 4실점했고 SSG 드류 앤더슨은 3⅔이닝 동안 88구를 뿌려 4피안타 4사사구 4탈삼진 4실점으로 부진했다. 앞서간 건 SSG였다. 두산 선발 어빈의 제구가 흔들리며 2회말 연속 몸에 맞는 공으로 출루했고 하재훈과 고명준의 연속 적시타, 최지훈의 희생플라이로 3-0으로 리드를 잡았다. 그러나 앤더슨도 흔들렸다. 3회초 정수빈에게 볼넷을 내준 뒤 2사 1루에서 김재환에게 1타점 2루타를 맞았고 4회엔 2사 1루에서 박준영에게 1타점 적시타, 정수빈에게 볼넷을 허용한 뒤 김민석에게 2타점 역전 적시타를 맞았다. SSG는 5회 기예르모 에레디아와 한유섬의 연속 안타로 기회를 잡았고 이지영의 희생번트에 이은 박성한의 유격수 땅볼 때 5-5 동점을 만들었다. 6회 두산에 뼈아픈 1점을 더 내줬다. 2사에서 정수빈과 김민석에게 연달아 볼넷을 허용했고 김재환에게 1타점 적시타를 맞고 5-6으로 끌려갔다. 앤더슨이 조기 강판된 뒤 한두솔, 이로운, 김건우, 김민, 노경은까지 등판시키며 SSG는 승리 욕망을 나타냈다. 이날 SSG랜더스필드엔 2만 3000명의 만원관중이 운집했다. 올 시즌 KBO리그 첫 번째 매진이자 3년 연속 개막전 매진 기록을 이어갔다. 많은 홈 관중 앞에서 쉽게 승리를 내줄 수 없다는 의지의 표현이었다. 8회초 2사에선 마무리 조병현까지 투입했다. 만원관중 앞에서 절대 승리를 내줄 수 없다는 SSG의 강한 열망은 결국 '약속의 8회'에 결실을 맺었다. 8회초 노경은에 이어 마무리 조병현까지 투입하며 실점없이 막아낸 SSG는 8회말 1사에서 박성한이 바뀐 투수 이영하를 상대로 볼넷을 얻어냈고 하재훈의 타석에 대타로 나선 오태곤이 볼카운트 1-1에서 시속 150㎞ 몸쪽 직구를 강타, 좌측 담장을 넘기는 역전 투런포를 쏘아 올렸다. 시즌 첫 번째 대타 홈런이자 개인 통산 5번째 대타 아치를 그렸다. 동시에 개막전에서 처음 보는 손맛이기도 했다. 9회초에도 마운드에 오른 조병현은 강승호를 2루수 뜬공, 양석환을 삼진아웃, 대타 김인태에게 안타를 맞았지만 박준영을 외야 뜬공으로 돌려세우며 기분 좋은 시즌 첫 승리를 수확했다.",2025-03-22
"KS급 불펜 때려넣기 + 8회말 대타 역전 홈런! SSG, 두산 6-5 역전드라마 썼다! [문학 현장리뷰]","[문학=스포츠조선 한동훈 기자] SSG 랜더스가 개막전 짜릿한 역전 드라마를 썼다. SSG는 22일 인천 SSG랜더스필드에서 열린 2025 신한SOL뱅크 KBO리그 개막전서 두산 베어스를 6대5로 물리쳤다. 선발 앤더슨이 4이닝도 버티지 못하는 바람에 구원투수 6명을 쏟아부었다. 8회말 오태곤이 대타 역전 2점 홈런을 폭발했다. 두산 선발 콜 어빈은 5이닝 4실점으로 부진했다. 어빈은 1회초 선두타자 최지훈을 상대로 볼 3개를 던지며 불안하게 출발했다. 하지만 곧바로 영점을 잡았다. 스트라이크 2개를 던져 풀카운트를 만든 뒤 헛스윙을 유도해 삼진을 잡았다. 정준재에게 볼넷을 주고 나서는 에레디아를 3루수 파울플라이, 한유섬을 다시 삼진 아웃시켰다. 어빈은 2회초 갑자기 흔들렸다. 대거 3점을 허용했다. 이지영과 박성한을 연속해서 몸에 맞는 공으로 출루시켰다. 무사 1, 2루에서 하재훈과 고명준에게 연속 적시타를 얻어맞았다. 2점을 잃고 무사 1, 3루 위기가 계속됐다. 박지환에게 삼진을 빼앗아 흐름을 끊었다. 1사 1, 3루에서 최지훈을 중견수 뜬공으로 잡았지만 3루 주자 하재훈의 태그업 득점까지 막지는 못했다. 두산은 3회부터 반격을 시작했다. 3회초 김재환의 적시 2루타로 1점을 만회했다. 4회초에는 '초대형 트레이드의 주인공' 김민석이 싹쓸이 역전타를 날리며 앤더슨을 끌어내렸다. 김민석은 2사 1, 2루에서 우익수 오른쪽을 꿰뚫는 3루타를 폭발했다. 하지만 어빈이 5회말 다시 1실점하며 믿음직한 모습을 보여주지 못했다. 두산은 4-4로 맞선 6회초 2사 1, 2루에서 김재환이 우전안타로 타점을 뽑아 리드했다. 계속된 2사 1, 2루에서 양의지가 삼진을 당해 추가득점에 실패했다. 양 팀 선발이 일찍 내려가면서 6회부터는 불펜 혈투가 전개됐다. 두산은 박치국이 6회부터 1⅓이닝을 무실점으로 막으면서 큰 역할을 해줬다. 두산은 7회말 1사 후 에레디아는 박정수로 잡았다. 2사 한유섬 타석에서는 좌완 이병헌을 투입해 이닝을 마쳤다. SSG는 앤더슨 이후 한두솔 이로운 김건우 김민 노경은 등 구원투수를 총동원했다. 4-5로 뒤진 8회초 2사 만루에 몰리자 마무리 조병현 카드를 꺼내는 초강수를 뒀다. SSG는 기어코 8회말 재역전에 성공했다. 두산 셋업맨 이영하를 무너뜨렸다. 1사 1루에서 하재훈 타석에 대타 등장한 오태곤이 2점 홈런을 폭발했다. 8회부터 등판한 조병현은 아웃카운트 4개를 책임지며 승리를 지켰다.",2025-03-22
"'MLB 출신' 두산 콜 어빈, 첫 등판서 불안함 딛고 5이닝 4실점","(인천=뉴스1) 문대현 기자 = 화려한 경력을 자랑하는 두산 베어스 외국인 투수 콜 어빈(31)이 KBO리그 개막전에서 승리투수 요건을 갖췄다. 어빈은 22일 인천 SSG랜더스필드에서 열린 2025 신한 SOL뱅크 KBO리그 SSG 랜더스와 개막전에 선발 등판해 5이닝 7피안타 3사사구 6탈삼진 4실점을 기록했다. 어빈은 4-4로 맞선 5회를 끝으로 마운드에서 내려왔고, 6회초 두산 타선이 1점을 내면서 어빈의 승리투수 요건이 만들어졌다. 어빈은 이날 던진 92구 중 투심(40개)과 직구(32개)를 많이 던졌다. 최고 구속은 142㎞까지 나왔다. 간간이 커브(6개)와 슬라이더, 체인지업(이상 3개)을 섞었다. 기대만큼 활약은 아니었으나, 불안함 속에서도 5회까지 막으며 최소한의 역할은 했다. 어빈은 지난해 외국인 투수 농사에 실패한 두산이 비시즌 야심 차게 영입한 '에이스'로, 메이저리그 무대에서 통산 134경기(선발 93경기) 28승 40패 평균자책점 4.54의 성적을 냈다. 2021~2024년 메이저리그에서 꾸준하게 선발 투수로 활약했으며, 다양한 구종과 함께 제구가 상당히 뛰어나다는 평가를 받았다. 시범경기에서 보여준 위력도 상당했다. 2경기 7이닝 동안 1점도 내주지 않으며 정규시즌에 대한 기대감을 키웠다. 1회 출발부터 나쁘지 않았다. 선두타자 최지훈을 삼진으로 잡고, 정준재에게 볼넷을 허용했으나, 중심타선 기예르모 에레디아와 한유섬을 범타로 돌려세웠다. 그러나 2회 난조를 보였다. 이지영과 박성한에게 연속 사구를 허용한 뒤 하재훈, 고명준에게 연속 적시타를 맞았다. 박지환을 삼진으로 막고 급한 불을 껐으나, 최지훈에게 1타점 희생타를 맞아 3번째 실점을 내줬다. 불안한 어빈을 야수들이 달랬다. 두산은 2-3으로 추격하던 4회 2사 1, 2루에서 김민석의 역전 2타점 3루타가 터지며 4-3으로 경기를 뒤집었다. 1점 앞선 상황에서 5회 마운드에 오른 어빈은 리드를 지키지 못했다. 에레디아와 한유섬에게 연속 안타를 내준 뒤 이지영의 희생번트로 1사 2, 3루로 몰렸고 박성한의 내야 땅볼 때 3루주자가 동점 득점에 성공했다. 5회를 마쳤을 때 어빈의 투구 수는 92개. 두산 벤치는 교체를 결심했다. 이때 6회초 두산이 2사 1, 2루에서 김재환이 SSG 필승조 김민에게 적시타를 뽑아내면서 어빈을 도왔다. 한편 지난 시즌 SSG에서 11승3패 평균자책점 3.89로 좋은 활약을 펼쳤던 드류 앤더슨은 이날 기대에 미치지 못했다. 앤더슨은 3⅔이닝 4피안타 4볼넷으로 4점을 내줬다. 앤더슨은 5회를 미처 채우지 못했고, 3-4로 뒤진 4회 2사 후 한두솔과 교체됐다. 이후 SSG 타선이 동점 점수를 내면서 앤더슨이 패전투수는 면했다.",2025-03-22
