news_title,news_content,published_date
"""내 공은 처음 보니까"" 이런 강심장을 봤나…SSG 국대 클로저, 어떻게 45홈런 현역 빅리거를 잡았나 [MD인천]","[마이데일리 = 인천 이정원 기자] ""내 공을 처음 보는 거고, 시즌 초반이기 때문에 자신감 있게 적극적으로 들어갔던 부분이 좋은 결과로 이어졌다."" SSG 랜더스 마무리 투수 조병현은 22일 인천 SSG랜더스필드에서 열린 2025 신한 SOL Bank KBO리그 두산 베어스와 시즌 개막전에 나섰다. 세이브 상황에 등판한 것이 아니다. 8회말 2사 만루에서 등판했다. 노경은이 선두타자 박준영에게 안타를 맞았다. 이후 정수빈을 뜬공으로 돌렸지만 김민석에게 안타를 맞았다. 김재환을 삼진으로 처리했지만, 양의지에게 볼넷을 내주며 2사 만루 위기를 내줬다. SSG 벤치는 노경은을 내렸고, 조병현을 올렸다. 4-5로 끌려가는 상황이지만, 8회초 위기를 막는다면 남은 두 번의 공격 기회에서 역전이 가능하다고 판단해 올렸다.
상대한 타자는 제이크 케이브. 지난 시즌 메이저리그 콜로라도 로키스에서 123경기 81안타 7홈런 37타점 42득점 타율 0.251을 기록한 현역 빅리거다. 메이저리그에서만 523경기 337안타 45홈런 176타점 190득점 타율 0.236의 기록을 남겼다. SSG가 자랑하는 투수 조병현은 흔들리지 않았다. 강력한 직구 2개로 케이브를 뜬공 처리하며 위기에서 넘겼다. 이 기세를 모아 SSG는 8회말 오태곤의 대타 역전 투런홈런이 터졌다. 6-5 역전. 9회에도 마운드에 올라온 조병현은 깔끔하게 두산 타선을 막으며 팀 승리를 지켰다. 시즌 개막전에서 승리도 챙겼다. 경기 후 조병현은 ""경기에 나가고 싶었고, 오늘 질 것 같지 않았다. 그리고 (오)태곤 선배가 홈런을 쳐주셨다. 너무 기뻤고 나도 팀에 도움이 되어서 기분이 좋다""라고 이야기했다. 이어 ""상대 타자가 내 공을 처음 보는 거고, 시즌 초반이기 때문에 자신감 있게 적극적으로 들어갔던 부분이 좋은 결과로 이어졌다""라고 덧붙였다. 직구와 포크볼뿐만 아니라 커브도 활용했다. ""불펜에서부터 커브 느낌이 좋았다""는 조병현은 ""올 시즌 스트라이크존이 낮아졌다. 커브, 포크볼 모두 떨어지는 구종이기 때문에 적극적으로 활용해 보려고 한다""라고 목소리를 높였다. 끝으로 조병현은 ""작년보다 더 높은 곳을 바라보고 최대한 늦게 시즌이 끝나도록 하겠다. 9회에 올라가면 무조건 이기는 게임 만들 수 있도록 하겠다""라고 각오를 다졌다. 조병현은 지난 시즌 추격조로 시즌을 시작했는데 필승조로 올라서더니 후반기에는 마무리 투수로 승격했다. 76경기(73이닝) 4승 6패 12세이브 12홀드 96탈삼진 평균자책 3.58. 특히 시즌 마지막 10경기에서는 7세이브 1홀드 평균자책 0으로 완벽에 가까웠다. 시즌 종료 후 열린 2024 WBSC(세계야구소프트볼연맹) 프리미어12 명단에도 이름을 올리며 태극마크를 달았다. 올 시즌에는 풀타임 마무리로 낙점받은 가운데 어떤 활약을 보여줄지 SSG 팬들의 기대가 크다.",2025-03-22
'18억 백업' 울분의 한 방! → '꿈이냐 생시냐' 손이 덜덜 떨려 사인도 못 했다 [문학 현장],"[문학=스포츠조선 한동훈 기자] 짜릿한 손맛은 경기가 끝나고도 이어졌다. SSG 랜더스 베테랑 백업요원 오태곤(34)이 프로 15년 만에 처음으로 '개막전 영웅'으로 등극했다. 오태곤은 22일 인천 SSG랜더스필드에서 열린 '2025 신한SOL뱅크 KBO리그' 개막전 두산 베어스와의 경기에 4-5로 뒤진 8회말, 1사 1루에 대타 등장했다. 이숭용 SSG 감독은 하재훈 타석에 오태곤을 대타로 꺼냈다. 하재훈은 3타수 1안타로 타격감이 좋았기 때문에 꽤 과감한 선택이었다. 오태곤은 두산 셋업맨 이영하를 무너뜨렸다. 1스트라이크 1볼에서 3구째 150km 패스트볼을 통타했다. 맞는 순간 홈런임을 직감할 수 있었다. 왼쪽 담장을 훌쩍 넘기며 이날의 역전 결승타로 기록됐다. 2011년 데뷔한 오태곤은 프로 15년차에 처음으로 개막전 홈런 맛을 봤다. 대타 홈런은 개인 5호다. 오태곤은 경기 MVP로 뽑혔다. 방송인터뷰 이후 팬들에게 나눠주기 위한 사인볼을 위해 공 6개에 사인을 해야 했다. 오태곤은 손을 덜덜 떨며 사인을 하나하나 간신히 해냈다. 홈런의 전율이 그때까지도 이어진 것이다. 오태곤은 2023시즌을 앞두고 SSG와 4년 총액 18억원 FA 계약을 체결했다. 대형 FA가 아니었던 오태곤은 자신에게 주어진 역할을 묵묵히 수행했다. 이날 경기 또한 선발 명단에서 빠졌지만 한 차례 돌아올 타석을 위해 집중해서 준비했다. 오태곤은 ""맞았을 때, 갔다고 생각했다. 갔다고 생각했는데 점점 휘어나가더라. 그 짧은 시간에 들어가라 들어가라 빌었다. 1초 2초 정도인데 그렇게 길게 느껴졌다""고 혀를 내둘렀다. 가운데에서 살짝 몸쪽으로 치우친 코스였다. 좌익수 방면으로 향한 타구는 왼쪽으로 휘어 나가기 마련이다. 오태곤은 파울이 되지 말라고 기도했다. 오태곤은 ""홈런이 돼서 진짜 너무 소름이 돋았다. 제가 그렇게 과하게 세리머니를 하는 사람이 아닌데 저도 모르게 그렇게 나왔다""고 기뻐했다. 이숭용 SSG 감독도 대만족이었다. 이 감독은 ""야수에서는 태곤이가 히어로다. 박빙승부에서 결정적인 홈런을 쳐줬다. 하위타선에서 5타점이 나왔다""고 함박웃음을 지었다.",2025-03-22
"최정이 당분간 없다… SSG 1-2-3, 미리 보는 청라의 풍경? 현재와 미래 모두 잡는다","[스포티비뉴스=인천, 김태우 기자] ""(김)광현이 형한테 팀이 진짜 젊어졌다고 이야기했다"" 22일 인천SSG랜더스필드에서 열린 두산과 시즌 개막전에서 4-5로 뒤진 8회 극적인 역전 대타 투런포로 팀을 승리로 이끈 오태곤(34)은 더그아웃에서 물끄러미 그라운드를 쳐다 보다 ""팀이 젊어졌다""는 이야기를 했다. 특히 내야가 그랬다. 이날 SSG의 내야는 뭔가 허전하면서도, 뭔가 불안하면서도, 또 뭔가 기대를 걸 수 있는 그런 오묘한 느낌들이 뒤섞여 있었다. 팀의 간판 스타이자, 오랜 기간 랜더스필드의 3루를 지킨 최정이 없었다. 최정은 시범경기 일정 막판 수비 훈련을 하다 햄스트링 부상을 당해 개막 로스터에 합류하지 못했다. 다행히 아주 큰 부상은 면했지만 3월 일정에는 들어오기 어렵다. 빨라도 4월 첫째주, 이숭용 SSG 감독은 4월 둘째주를 예상한다. 그러다 보니 3루에 2년 차 선수인 박지환이 들어오고, 또 지난해를 통해 자리를 잡은 선수들이 위치하니 내야가 확 젊어졌다. 이날 3루에는 2005년생의 박지환, 유격수에는 1998년생의 박성한, 2루에는 2003년생의 정준재, 그리고 1루에는 2002년생의 고명준이 섰다. KBO리그 10개 구단 전체를 따져도 그렇게 젊은 내야는 찾아보기 힘들다. 오태곤이 ""젊어졌다""는 느낌을 받기 충분했다. 최정은 앞으로 최소 4년간은 팀과 더 함께하겠지만, 궁극적으로는 그 이후의 미래 라인업이 될 수도 있다. 최정이 지명타자 자리로 들어가는 시기가 오면 그 주전 라인업을 더 자주 찾아볼 수도 있다. 이중 팀의 왼쪽 내야가 흥미롭다. 등번호도 나란히 1-2-3이다. 박성한은 원래 등번호 2번을 썼고, 올해 박지환(1번)과 정준재(3번)가 등번호를 바꾸면서 SSG 등번호 1~3번 선수들이 나란히 모여 있는 광경이 연출됐다. 모두 팀에서 큰 기대를 걸고 있는 자원들이다. 앞으로 해야 할 일이 많은 선수들이기도 하다. 최정이 돌아올 때까지, 세 선수가 만들어 나가고 합작할 성과들에 기대가 몰리는 이유다. 박성한이야 이미 리그 최고의 유격수 중 하나다. 2021년 팀의 주전 유격수로 자리잡은 뒤 3할을 두 번이나 쳤다. 여기에 지난해에는 생애 첫 두 자릿수 홈런까지 기록했고, 이제는 수비에서도 경쟁자들에 비해 크게 뒤처지지 않는다는 평가를 받는다. 프리에이전트(FA) 시점이 점차 다가오고 있기는 하지만 임박한 것은 아니고, 만약 팀에 남는다면 앞으로 10년 가까이 팀의 유격수로 내야를 진두지휘할 선수다. 정준재는 지난해 알토란같은 활약으로 올해 개막 주전 2루수 자리를 꿰찼다. 지난해 정식 선수로 전환된 이후 1군 88경기에서 타율 0.307, 출루율 0.371을 기록했다. 타석에서 끈질긴 선수고 커트 능력도 있다. 기본적인 작전 수행 능력에 지난해 16개의 도루를 성공시켰을 정도로 발도 빠르다. 경기 체력도 좋다는 평가다. 재간둥이 스타일로 이숭용 SSG 감독이 올해 주전 2루수로 낙점했다. 잠재력 하나는 박지환이 두 선수에 뒤지지 않는다. 지난해 고졸 신인이라고는 믿기 어려운 타격으로 한때 센세이션을 일으켰다. 가을 마무리캠프부터 올해 스프링캠프까지 수비 및 타격에서 강훈련을 소화하며 더 좋아졌다는 평가를 받았다. 최정이 지명타자로 들어갈 때는 3루, 박성한의 휴식 시간이 필요할 때는 유격수, 그리고 타격이 좋으면 우익수로도 투입해 최대한 많은 출전을 시킨다는 생각이었다. 그런데 최정이 부상으로 당분간 출전이 어려워 박지환에게 넓은 기회가 생겼다. 이숭용 감독은 ""박지환을 믿고 기용할 생각""이라고 밝혔다. 물론 최정이 돌아오면 다시 여러 개편이 있을 전망이지만, 세 선수는 청라 시대에도 활용될 가능성이 높은 선수들이라는 점에서 현재는 물론 미래도 쥐고 있다. 큰 형님이 돌아올 때까지 그 몫을 잘 나눠 들어 위기를 극복한다면 그 자체로도 한 단계 성장한다는 것을 의미한다. 최정의 공백은 뼈아프지만, 이 공백에서 뭔가를 확인할 수 있다면 하나의 위안은 될 수 있을 것이다.",2025-03-22
"'1선발 조기강판→KS급 총력전' 사령탑은 '왜' 끌려가던 경기에... ""기분 좋게 집에 가시라고"" 만원관중에 약속 지켰다 [인천 현장]","[스타뉴스 | 인천=안호근 기자] 한국시리즈를 방불케하는 총력전이었다. 믿었던 1선발을 조기강판했고 필승조를 비롯한 불펜 투수 6명을 투입했다. 초강력 승부수는 최고의 결과로 이어졌다. SSG 랜더스가 창단 후 개막전 전승 기록을 이어갔다. 이숭용(54) 감독이 이끄는 SSG는 22일 인천 SSG랜더스필드에서 열린 두산 베어스와 2025 신한은행 SOL뱅크 KBO리그 개막전에서 6-5 짜릿한 역전승을 거뒀다. 지난 시즌 1000만 관중 시대를 연 KBO리그이고 비시즌 기간에도 그 열기가 이어졌다. 팬들은 개막전만을 손꼽아 기다렸고 예매가 오픈되자마자 치열한 클릭 전쟁을 벌였다. 그 가운데서도 SSG랜더스필드의 경기가 가장 빨리 매진 소식을 알렸다. SSG는 이날 오전 10시 경 매진 소식을 전했다. 2만 3000석의 판매좌석이 모두 팔려나갔는데 이는 올 시즌 KBO리그 첫 번째 매진인 동시에 SSG의 개막전 3년 연속 매진 기록이기도 했다. 경기를 앞둔 이숭용 감독은 ""부담도 느끼지만 늘 감사하다. 지난 시즌에는 홈에서 승률이 그렇게 좋지가 않았는데 올해는 홈 승률에 대해서도 더 신경을 쓰고 싶다""며 ""관중들이 이렇게 오시는 만큼 좋은 퍼포먼스를 해야하고 웬만하면 좋은 승리로 기분 좋게 스트레스도 풀고 집에 돌아갈 수 있게끔 만드는 게 저희가 해야 할 역할""이라고 강조했다. 1선발 드류 앤더슨을 내세운 SSG는 2회말 상대 선발 콜 어빈을 공략하며 3점을 선취했다. 1,2회를 잘 막아낸 앤더슨이 5회 이상 버티며 제 역할을 해주면 기분 좋은 승리를 챙길 수 있을 것이라는 예감을 갖게 했다. 그러나 예상치 못한 데에서 문제가 생겼다. 앤더슨이 3회 1점을 내주더니 4회 흔들리며 추가 3실점하며 역전을 허용했다. 결국 4회를 채 버티지 못하고 한두솔에게 공을 넘겼다. 이후 SSG의 벌떼 야구가 시작됐다. 한두솔이 ⅔이닝, 이로운이 1⅓이닝을 실점없이 막아냈다. 6회 2사 주자 없는 상황에서 등판한 김건우가 연속 볼넷을 허용하며 흔들렸고 김민이 배턴을 넘겨받았다. 이 과정에서 김재환에게 적시타를 맞고 1실점했지만 더 이상은 흔들리지 않았다. 노경은 8회 2사까지, 이후엔 마무리 조병현이 등판했다. 만원관중에게 어떻게든 승리를 선사하겠다는 이숭용 감독의 의지를 읽어볼 수 있는 대목이었다. 8회 선수들이 응답했다. 1사에서 박성한이 볼넷을 얻어냈고 하재훈의 타석에 대타로 나선 오태곤이 통렬한 좌월 투런 역전 홈런을 터뜨렸다. 승리까지 아웃카운트 3개. 강승호를 2루수 뜬공으로 돌려세운 조병현은 양석환에게 강력한 직구를 뿌려 헛스윙 삼진을 잡아냈다. 대타 김인태에게 안타를 맞았지만 박준영을 중견수 뜬공으로 돌려세워 올 시즌 SSG의 첫 승리를 확정지었다. 경기 후 이숭용 감독은 ""개막전이라 꼭 이기고 싶었다. 만원관중으로 화답해 주신 팬분들에게 좋은 선물이 된 거 같다""며 ""불펜을 빨리 가동한 상황에서 한 박자 빠른 투수 교체로 최소 실점으로 잘 막았다. (한)두솔이, (이)로운이, (김)민이, (노)경은이, (조)병현이까지 너무 잘 던져줬다. 승리의 밑거름이었다""고 칭찬했다. 야수들 가운데선 단연 오태곤이 수훈선수였다. 이 감독은 ""야수에서는 태곤이가 히어로다. 박빙승부에서 결정적인 홈런을 쳐줬다""며 ""하위 타선에서 5타점이 나왔다. 투타의 핵심 선수들이 빠져있지만 선수들이 똘똘 뭉쳐 만든 시즌 첫 승""이라고 만족감을 나타냈다. 선수들도 승리에 대한 열망의 크기는 똑같았다. 이로운은 ""이길 수 있을 것이라고 믿고 있었다. 지고 있어도 질 것 같지 않았다""며 ""마운드에 올라가서 중간다리 역할을 잘하고 싶었다. 경기가 이길 분위기였다. 팬들도 열심히 응원해줘서 승리할 수 있었다""고 소감을 밝혔다. 이어 ""개막전이라도 144경기 중 한 경기라 생각했다. 내 본분을 다하고 싶었다. 내가 잘 막으면 타자들이 점수를 내 줄 것이라 믿었다""고 동료들에 대한 깊은 신뢰감을 나타냈다. 마무리로서 팀의 첫 승을 챙긴 조병현 또한 ""경기에 나가고 싶었고 오늘 질 것 같지 않았다""며 ""그리고 (오)태곤 선배가 홈런을 쳐주셨다. 너무 기뻤고 나도 팀에 도움이 돼 기분이 좋다""고 전했다. 최고의 엔딩으로 시즌 출발을 알린 조병현은 ""작년보다 더 높은 곳을 바라보고 최대한 늦게 시즌이 끝나도록 하겠다""며 ""9회에 올라가면 무조건 이기는 게임 만들 수 있도록 하겠다""고 각오를 밝혔다.",2025-03-22
"SSG 개막전 승리 이끈 '수호신' 조병현 ""적극적인 직구 승부 효과""","(인천=뉴스1) 문대현 기자 = 개막전부터 깔끔한 투구로 팀에 승리를 안긴 조병현(SSG 랜더스)이 자신감을 전했다. SSG는 22일 인천 SSG랜더스필드에서 열린 2025 신한 SOL뱅크 KBO리그 두산 베어스와 홈 개막전에서 6-5로 이겼다. 이날 SSG의 수훈갑은 오태곤이었다. 오태곤은 4-5로 밀리던 8회말 1사 1루에서 하재훈의 대타로 나와 벼락같은 역전 투런포를 뿜어냈다. 이후 SSG가 6-5로 이기며 오태곤이 결승타의 주인공이 됐다. 마운드에서는 조병현의 활약이 컸다. 조병현은 8회초 2사 만루에 노경은의 다음 투수로 등판했다. 1점 차로 지는 상황이었지만, 반드시 이 경기를 잡겠다는 이숭용 감독의 구상에 조병현이 마운드에 올랐다. 첫 상대는 두산의 새 외인 제이크 케이브. 처음 마주하는 상대라 서로에 대한 정보가 부족했는데, 조병현은 자신 있게 직구를 꽂아 넣어 2구 만에 좌익수 뜬공으로 돌려보냈다. 이후 오태곤의 홈런이 터지며 SSG가 역전했고, 조병현이 9회 1점을 지키러 등판했다. 첫 상대 강승호를 내야 뜬공으로 간단히 처리한 조병현은 양석환마저 삼진으로 잡았다. 대타 김인태에게 안타를 허용했으나, 후속타자 박준영을 초구 만에 외야 뜬공 처리하며 승리를 지켰다. 조병현이 승리투수가 된 순간이었다. 조병현은 경기 후 구단을 통해 ""오늘 왠지 질 것 같지 않았는데, (오)태곤 선배가 홈런을 쳐서 정말 기뻤다. 나 역시 팀에 도움이 돼서 좋다""고 말했다. 8회 2사 만루 상황을 돌이키면서는 ""상대 타자가 내 공을 처음 보는 거라 자신 있게 적극적으로 들어간 부분이 좋은 결과로 이어졌다""고 만족했다. 150㎞의 속구를 보유한 조병현은 예리한 커브까지 갖춰 상대를 혼란스럽게 한다. 올 시즌에도 커브와 포크볼 등 변화구를 적극 활용할 생각이다. 그는 ""올해 스트라이크존이 더 낮아졌다. 커브와 포크볼 모두 떨어지는 구종이니 적극적으로 활용할 것""이라며 ""9회에 내가 등판하면 무조건 이기는 경기를 만들겠다""고 자신감을 내비쳤다.",2025-03-22
"투수 7명 쏟아붓는 총력전→8회 대타 역전포 개막전 짜릿 극장승 ""태곤이가 히어로! 만원 관중 좋은 선물 드렸어"" [문학 현장]","(엑스포츠뉴스 문학, 김근한 기자) SSG 랜더스가 개막전부터 투수 7명을 쏟아붓는 총력전 끝에 대타 오태곤의 8회 극적인 역전 2점 홈런으로 짜릿한 극장승을 거뒀다. SSG는 22일 인천 문학SSG랜더스필드에서 2025 신한 Sol 뱅크 KBO리그 두산 베어스전을 치러 6-5로 승리했다. 이날 SSG는 최지훈(중견수)-정준재(2루수)-에레디아(좌익수)-한유섬(지명타자)-이지영(포수)-박성한(유격수)-하재훈(좌익수)-고명준(1루수)-박지환(3루수)으로 이어지는 선발 타순을 앞세워 두산 선발 투수 어빈과 맞붙었다. SSG 선발 투수는 앤더슨이었다. SSG는 2회 말 무사 1, 2루 기회에서 하재훈과 고명준의 연속 적시타와 최지훈의 희생 뜬공으로 3점을 먼저 가져갔다. 하지만, SSG는 선발 앤더슨이 흔들리면서 3회 초 첫 실점을 허용한 뒤 4회 초 김민석에게 역전 적시 3루타를 맞아 3-4로 끌려갔다. 5회 말 박성한의 땅볼 타점으로 4-4를 만든 SSG는 6회 초 김재환에게 다시 1타점 적시타를 맞아 리드를 내줬다. SSG 벤치는 8회 초 2사 만루 위기에서 마무리 투수 조병현을 조기에 투입했다. 조병현은 케이브를 좌익수 뜬공으로 돌려세우고 실점을 막았다. 반격에 나선 SSG는 8회 말 1사 뒤 박성한의 스트레이트 볼넷으로 기회를 잡았다. 그리고 대타 오태곤이 나와 바뀐 투수 이영하의 150km/h 속구를 통타해 비거리 110m짜리 좌월 역전 투런 아치를 그렸다. SSG는 9회 초 마무리 조병현을 그대로 올려 경기를 마무리했다. 경기 뒤 이숭용 감독은 ""개막전이라 꼭 이기고 싶었다. 만원 관중으로 화답해 주신 팬분들에게 좋은 선물이 된 듯싶다""며 ""불펜진을 빨리 가동한 상황에서 한 박자 빠른 투수 교체로 최소 실점으로 잘 막았다. 한두솔, 이로운, 김민, 노경은, 조병현까지 너무 잘 던져줬다. 승리의 밑거름이었다""고 기뻐했다. 이어 ""야수에서는 오태곤이 히어로다. 박빙 승부에서 결정적인 홈런을 쳐줬다. 하위 타선에서 5타점이 나왔다. 투·타 핵심 선수들이 빠졌지만, 선수들이 똘똘 뭉쳐 만든 시즌 첫 승이다. 마지막으로 만원 관중으로 성원을 보내주신 팬들에게 감사드린다""라고 전했다. 팀 마운드 위에선 7명의 투수가 총출동해 개막전 승리를 지켰다. 특히 마무리 투수 조병현이 8회 초 2사 만루 위기에서 조기 등판해 상대 외국인 타자 케이브를 범타 처리한 장면도 결정적이었다. 멀티 이닝과 함께 시즌 첫 세이브로 개막전 승리를 이끈 투수 조병현도 ""경기에 나가고 싶었고, 오늘 질 것 같지 않았다. 그리고 (오)태곤 선배가 홈런을 쳐주셨다. 너무 기뻤고 나도 팀에 도움이 돼 기분이 좋다""며 ""8회 초 만루 상황에서 상대 타자가 내 공을 처음 보는 거고, 시즌 초반이기 때문에 자신감 있게 적극적으로 들어갔던 부분이 좋은 결과로 이어졌다""라고 소감을 밝혔다. 이어 조병현은 ""불펜에서부터 커브 느낌이 좋았다. 올 시즌 스트라이크 존이 낮아졌다. 커브, 포크볼 모두 떨어지는 구종이기 때문에 적극적으로 활용하려고 한다""며 ""지난해보다 더 높은 곳을 바라보고 최대한 늦게 시즌이 끝나도록 하겠다. 9회에 올라가면 무조건 이기는 게임 만들 수 있도록 하겠다""라고 힘줘 말했다. 사진=SSG 랜더스",2025-03-22
"302억 3루수&박찬호 닮은꼴 빠지고, K머신도 흔들렸는데…8회 주인공이 등장했다 ""태곤이가 히어로"" [MD인천]","[마이데일리 = 인천 이정원 기자] ""태곤이가 히어로다."" 이숭용 감독이 이끄는 SSG 랜더스는 22일 인천 SSG랜더스필드에서 열린 2025 신한 SOL Bank KBO리그 두산 베어스와 시즌 개막전에서 6-5 승리를 챙겼다. 5년 연속 개막전 승리. 8회말 시작 전까지 4-5로 끌려가던 SSG는 8회 역전 드라마를 연출했다. 1사 이후 박성한이 볼넷을 골라 출루했다. 이후 하재훈 대신 나선 오태곤이 1B-1S에서 이영하의 150km 직구를 공략해 좌측 담장을 넘어가는 투런홈런으로 연결했다. 오태곤의 개막전 첫 홈런이자, 개인 통산 5번째 대타 홈런. 경기 후 이숭용 감독은 ""개막전이라 꼭 이기고 싶었다. 만원 관중으로 화답해 주신 팬분들에게 좋은 선물이 된 것 같다""라며 ""태곤이가 히어로다. 박빙 승부에서 결정적인 홈런을 쳐줬다""라고 박수를 보냈다. 오태곤뿐만 아니라 고명준이 2안타 1타점으로 활약했고, 박성한도 1안타 1타점 2득점으로 팀 승리에 기여했다. 이 감독은 ""하위타선에서 5타점이 나왔다. 투타의 핵심 선수들이 빠져있지만 선수들이 똘똘 뭉쳐 만든 시즌 첫 승이다""라고 이야기했다. 선발 드류 앤더슨이 4회를 채우지 못하고 내려갔다. 3⅔이닝 4피안타 4사사구 4탈삼진 4실점으로 흔들렸다. 이후 올라온 한두솔과 이로운이 2이닝을 무실점으로 막았다. 김건우(0이닝 2사사구 1실점)으로 흔들렸지만 김민(1이닝), 노경은(1이닝), 조병현(1⅓이닝)이 무실점 호투를 펼치며 팀 승리에 힘을 더했다. 이숭용 감독은 ""불펜이 빨리 가동된 상황에서 한 박자 빠른 투수 교체를 통해 최소 실점으로 잘 막았다. 두솔이, 로운이, 민이, 경은이, 병현이까지 너무 잘 던져줬다. 승리의 밑거름이었다""라고 이야기했다. 끝으로 이 감독은 ""마지막으로 만원 관중으로 성원을 보내주신 팬들에게 감사드린다""라고 인사했다. 투타 핵심 미치 화이트와 최정이 빠진 상황에서도 기분 좋은 시즌 출발을 알린 SSG는 23일 선발로 김광현을 예고했다. 두산은 잭로그를 앞세워 시즌 첫 승에 도전한다.",2025-03-22
