news_title,news_content,published_date
"메이저리거 출신 케이브, 개막 2경기 무안타 침묵...두산 2연패 부진","[진병두 마니아타임즈 기자] 두산 베어스의 새 외국인 타자가 시즌 초반 한국 투수들의 공략법에 고전하고 있다. 메이저리그에서 검증된 실력을 가진 제이크 케이브가 개막 두 경기에서 답답한 침묵을 이어가며 팀의 부진에 한몫했다. 23일 인천 SSG랜더스필드에서 펼쳐진 '2025 신한 SOL Bank KBO' SSG와의 원정 경기에서 두산은 2-5로 패배했다. 이로써 두산은 새 시즌을 2연패로 시작했고, 반면 SSG는 개막 2연승을 달성했다. 지난 시즌 메이저리그 콜로라도에서 활약한 케이브는 MLB 통산 523경기에서 타율 0.251, 45홈런, 176타점을 기록한 검증된 타자다. 두산은 영입 당시 강한 손목 힘에서 나오는 빠른 배트 스피드가 케이브의 장점이라고 소개했지만, 한국 무대에서는 아직 적응이 더딘 모습이다. 개막전에서 4타수 무안타에 그친 케이브는 이날 경기 전 그라운드에 일찍 나와 다부진 표정으로 타격 연습에 임했다. 베테랑 강승호에게 여러 질문을 던지며 적응을 위한 노력을 보였지만, 실전에서는 아쉬운 결과가 이어졌다. 첫 타석인 1회초 2사 1루 상황에서 케이브는 SSG 에이스 김광현의 132km 슬라이더를 받아쳤으나 1루수 정면 땅볼에 그쳤다. 아쉬움에 배트를 공중으로 던지는 모습에서 그의 답답함이 엿보였다. 4회초 두 번째 타석에서는 김광현의 137km 슬라이더에 헛스윙 삼진을 당했고, 5회초 세 번째 타석에서도 139km 슬라이더에 또다시 삼진으로 물러났다. 더그아웃으로 돌아오는 케이브를 이승엽 감독이 외면하는 장면도 포착됐다. 8회초 마지막 타석에서는 SSG 투수 김민의 143km 투심을 받아쳤으나 중견수 플라이로 잡히며 이날도 4타수 무안타로 경기를 마쳤다. 개막 후 7타수 무안타의 부진한 성적이다. 케이브의 저조한 활약은 시범경기부터 예견된 측면이 있다. 그는 시범경기 9경기에서 25타수 6안타, 타율 0.240으로 기대에 미치지 못하는 모습을 보였다. 이에 대해 이승엽 감독은 케이브가 메이저리그에서 좋았을 때의 실력으로 돌아오기를 기다릴 수밖에 없다고 설명했다. 감독은 아마도 종이 한 장 차이인 것 같은데, 그것만 본인이 느끼면 좋아질 것이라는 기대감을 드러냈다. 한편 두산은 이날 선발 잭 로그가 6이닝 3피안타 2사사구 5탈삼진 4실점으로 준수한 투구를 선보였고, 타선에서는 이유찬이 2안타 2타점, 강승호가 3안타 2득점, 양석환이 3안타를 기록하는 등 국내 타자들의 활약이 있었지만, 팀 패배를 막아내지는 못했다.",2025-03-25
"그라운드 덮친 부상 악몽, 시즌 출발부터 ‘잇몸’ 고민 KBO 리그","최정, 곽빈에 이어 김도영까지 이탈했다. 시즌 극 초반부터 부상 악몽이 KBO리그를 휘감고 있다. SSG 최정은 지난 17일 수비 훈련 도중 햄스트링을 다쳤다. 시즌 개막을 불과 5일 앞둔 시점이었다. 오는 31일 재검이다. 검진 결과가 좋다면 곧바로 기술 훈련까지 소화할 수 있다고 하지만, 정확한 복귀 시점은 아직 가늠하기 어렵다. 최정보다 앞서 햄스트링을 다쳤던 새 외국인 투수 미치 화이트가 1군 합류를 앞두고 있다는 게 그나마 다행이다. SSG는 25일 “화이트는 24일 재검 결과 우측 햄스트링 정상 회복 소견을 받았다”고 전했다. 곧장 정상훈련에 들어가 불펜피칭까지 소화할 계획이다. 1~2차례 불펜피칭 후 특이사항이 없다면 라이브 피칭과 2군 경기 등판 등 복귀 절차를 차례로 밟는다. 두산은 개막 직전 에이스 곽빈과 필승조 홍건희를 잃었다. 곽빈은 옆구리, 홍건희는 팔꿈치를 다쳤다. 두 사람 다 4월 초 재검진을 거쳐야 몸 상태를 제대로 알 수 있다. 당연히 복귀 시점도 아직 미정이다. 리그를 대표하는 스타들이 줄이어 부상으로 이탈했는데, 지난 시즌 최우수선수(MVP) 김도영마저 개막전 불의의 부상을 입었다. 김도영은 22일 광주 NC전 안타를 치고 전력질주하다 왼쪽 햄스트링을 다쳤다. 1차 검진에서 그레이드1(부분 손상) 진단을 받은 게 불행 중 다행이다. 워낙에 팀 전력의 주축들이다 보니 타격이 크다. SSG는 개막 2연전을 쓸어 담았지만, 3~5 선발이 나설 앞으로 일정이 고민이다. 최정의 빈자리는 더 크게 느껴진다. 지난해 신인 박지환으로 수비 구멍을 메우고, 우타 화력은 하재훈에게 기대를 걸고 있지만 최정의 역할을 대신하기는 아무래도 부족하다. 두산은 개막 첫 이틀 동안 이미 마운드 손실을 뼈저리게 느꼈다. 불펜 타격이 특히 크다. 홍건희가 빠졌고, 곽빈을 대신해 선발로 올라간 최원준도 빠졌으니 중간에 구멍이 크게 2개가 난 셈이다. 두산은 SSG를 상대로 개막전 8회에 역전 홈런을 맞았다. 이튿날 경기도 1점 차 승부를 벌이다 7회 결정적인 추가 2실점을 내줬다. 올 시즌 ‘절대 1강’으로 꼽히는 KIA도 김도영의 이탈은 고민이 크다. 아무리 선수층이 두껍다고 해도, MVP를 대신할 선수는 없기 때문이다. 지난 23일 NC전을 앞두고는 1루수 패트릭 위즈덤이 3루 훈련을 하는 장면이 포착되기도 했다. 윤도현·변우혁 등 3루 자원이 없지 않지만, 만약의 경우를 대비한다는 설명이다. 이들뿐 아니다. 시즌은 이제 시작했는데, 온전한 전력을 갖춘 팀이 많지 않다. LG는 함덕주, 유영찬의 부상 공백 속에 FA로 영입한 장현식마저 아직 1군 경기를 뛰지 못했다. NC는 이용찬·이재학·김영규 등 주축 투수 3명이 부상 회복 중이다. 키움 김동엽은 시범경기 중 투구에 손목을 맞아 골절 진단을 받았다. 회복까지 4주는 걸린다는 전망이다. 전력 평준화 속에 치열한 5강 경쟁이 예상되는 시즌이다. 초반 레이스에서 뒤처지면 만회하기 쉽지 않다는 평가다. 어느 팀 ‘잇몸’이 더 튼튼한지가 시즌 초 핵심 변수로 떠올랐다. 심진용 기자 sim@kyunghyang.com",2025-03-25
"‘이럴 수가’ 다승왕도 없는데, ‘41억’ 외인 트리오 부진…우승후보와 3연전, 토종선발 3총사 어깨 무겁다","[OSEN=이후광 기자] 개막시리즈에서 예상치 못한 스윕패를 당한 두산 베어스가 ‘우승 후보’ KT 위즈를 만난다. ‘다승왕’ 곽빈과 ‘필승조’ 홍건희의 부상 이탈, 특급 외국인 트리오의 부진 등 시즌 초반 찾아온 악재를 딛고 분위기를 바꿀 수 있을까. 이승엽 감독이 이끄는 두산 베어스는 25일부터 수원KT위즈파크에서 펼쳐지는 2025 신한 SOL뱅크 KBO리그 KT 위즈와 주중 3연전을 앞두고 있다. 두산의 지난 주말 개막시리즈 성적은 2패. 시즌에 앞서 대다수 전문가들이 5강 후보에 포함시키지 않은 SSG 랜더스를 만나 충격의 스윕패를 당했다. 개막전에서 타격전 끝 5-6 아쉬운 1점차 패배를 당한 뒤 이튿날 2-5로 무릎을 꿇었다. 두산은 롯데 자이언츠, 키움 히어로즈와 함께 5할 승률 -2로 시즌을 출발했다. 역대급 영입으로 평가받는 외국인투수 듀오를 내고도 당한 2패라 데미지가 더욱 컸다. 메이저리그 통산 28승에 빛나는 콜어빈이 개막전에서 5이닝 7피안타 3사사구 6탈삼진 4실점 난조를 보였고, 스위퍼를 던지는 좌완투수로 기대를 모은 잭 로그 또한 6이닝 7피안타 2볼넷 5탈삼진 4실점으로 흔들리며 데뷔전에서 패전을 떠안았다. 타선에서는 또 다른 현역 메이저리거 출신 제이크 케이브가 침묵했다. 2경기 9타석을 소화, 8타수 무안타 1볼넷 4삼진으로 기대에 부응하지 못했다. 두산은 총액 280만 달러(약 41억 원)를 투자해 최강 외인 트리오를 구축했지만, ‘새 환경 적응’이라는 변수 앞에서는 장사가 없었다. 24일 휴식으로 전열을 정비한 두산은 25일부터 새로운 시리즈에 나선다. 그런데 불운하게도 외국인투수 카드를 모두 소진한 상태에서 ‘우승 후보’ KIA 타이거즈의 대항마로 불리는 KT를 만나게 됐다. KT는 개막시리즈에서 한화 이글스에 1승 1패를 거뒀는데 23일 연장 11회말 배정대의 짜릿한 끝내기안타가 터지며 그 어느 팀보다 좋은 분위기로 한 주를 마쳤다. 사실 원래 두산은 ‘마법사 킬러’ 곽빈을 앞세워 주중 3연전의 기선을 제압할 계획이었다. 곽빈은 지난해 KT 상대 6경기 5승 무패 평균자책점 1.51의 강세를 보였던 터. 그런데 곽빈이 개막 직전 퓨처스리그 최종 모의고사에서 내복사근이 손상되는 악재가 발생하며 모든 계획이 어그러졌다. 곽빈은 내달 초 재검진 일정이 잡혔다. 이승엽 감독은 필승조 전환을 고민하기도 했던 ‘원조 토종 에이스’ 최원준을 곽빈의 대체자로 낙점했다. 25일 최원준을 시작으로 26일 최승용, 27일 김유성이 차례로 등판하는 일정이다. 곽빈 이전에 토종 에이스였던 최원준은 절치부심을 외치며 비활동기간에 사비를 들여 미국 아카데미에 다녀왔다. 시범경기에서 2경기 1승 무패 평균자책점 1.29로 땀의 결실도 맺었다. 신예 김유성에 구위에서 밀려 5선발 경쟁에서 고배를 마셨지만, 곽빈의 이탈로 다시 선발 기회가 찾아왔다. 그것도 과거 익숙했던 토종 에이스 자리에서 말이다. 최원준의 통산 KT전 성적은 21경기(선발 13경기) 2승 6패 평균자책점 5.60. 수원에서는 10경기(선발 6경기) 1승 2패 평균자책점 6.44를 남겼다. 지난해에도 KT를 만나 2경기 1승 1패 평균자책점 10.00으로 부진했는데 비시즌 그 누구보다 굵은 땀방울을 흘렸기에 반등에 관심이 쏠린다. 최원준에게는 친한 동생이자 팀의 에이스인 곽빈의 자리를 메워야한다는 책임감도 있다. 한편 두산에 맞서는 KT는 토종 에이스 고영표 카드를 꺼내들었다. 시범경기에서 2경기 2승 평균자책점 3.38로 몸을 푼 고영표는 지난해 두산에 3경기 승리 없이 3패 평균자책점 7.20으로 부진했다. 공교롭게도 시즌 첫 등판부터 동국대 3년 후배와의 잠수함 맞대결이 성사됐다. /backlight@osen.co.kr",2025-03-25
"초대형 트레이드 대성공! 새 1번타자 나왔다. 그러나 → ""강백호·홍창기 선배님과 비교도 안 된다""","[스포츠조선 한동훈 기자] 두산 베어스가 개막 2연패에 빠졌으나 위안거리를 찾았다. '초대형 트레이드의 주인공' 김민석이 리드오프 자리에서 제 몫을 해내며 타선에 짜임새를 더했다. 다만 김민석은 타 팀 톱타자인 강백호(KT) 홍창기(LG)에 비할 바가 아니라고 겸손하게 자신을 낮췄다. 김민석은 SSG 랜더스와의 개막 2연전에 1번타자 겸 좌익수로 선발 출전했다. 두산의 리드오프는 전통적으로 정수빈이었다. 이승엽 두산 감독은 베테랑 정수빈의 체력을 안배하고 김민석의 정교한 맞히기 능력을 극대화하기 위해 올 시즌 새로운 타순을 시도했다. 정수빈을 9번에 두고 1번 김민석 뒤에 2번에 거포 김재환을 바로 붙였다. 김민석은 개막전 멀티히트를 기록했다. 3루타 포함. 2타점도 올렸다. 2차전에는 SSG 좌완 에이스 김광현을 만나 고전했지만 끝내 안타 하나를 추가했다. 2연전 타율 0.333에 출루율 0.400으로 리드오프 합격점이다. 김민석은 두산이 지난해 11월 롯데 자이언츠와 트레이드를 통해 영입한 외야수다. 김민석은 2023 신인드래프트 1라운드 전체 3번에 뽑힌 대형 유망주였다. 두산은 신인왕 출신 구원투수 정철원과 내야유틸리티 전민재를 내줬다. 두산은 즉시전력 외야수 김민석 추재현과 투수 유망주 최우인을 받았다. 김민석은 외야 한 자리가 고민이었던 두산의 가려운 곳을 시원하게 긁어줬다. 전지훈련과 시범경기를 통해 실력을 증명했고 정규시즌에 들어와서도 경기력을 유지했다. 이승엽 두산 감독도 만족감을 나타냈다. 이승엽 감독은 ""우리가 (김)민석이에게 기대했던 부분이 충분히 나왔다. (정)수빈이도 9번으로 가면서 부담이 많이 줄어든 것 같다. 김민석은 공도 잘 보고 수비 주루에서 워낙 역할을 잘해주는 선수다. 앞으로도 계속 이어갈 타선이 되지 않을까 생각한다""고 칭찬했다. 김민석은 아직 갈 길이 멀다고 했다. 김민석은 ""개막전은 처음이라 긴장을 많이 했다. 1번타자는 경기 시작을 알리는 타자다. 팀 분위기에 큰 영향을 줄 수 있다. 그렇다고 매번 잘 칠 수는 없다. 그래도 항상 자기 스윙을 하려고 한다. 그래야 아웃을 당하더라도 팀 분위기가 올라가고 상대 투수와 기 싸움에서 밀리지 않는다고 생각한다""고 소신을 밝혔다. 이어서 ""KT에 강백호 형도 있고 LG에 홍창기 선배님도 계신다. 이런 선배님들과는 아직 비교도 되지 않는다. 하지만 최대한 그렇게 따라갈 수 있도록 저도 저만의 그런 방향성과 색깔을 찾아서 유지하고 싶다""고 다짐했다. 김민석 본인도 스포트라이트를 받으며 인기가 높아졌다는 사실을 안다. 김민석은 한눈 팔지 않고 오직 야구에만 집중하겠다는 마음이다. 김민석은 ""인기 같은 것은 나중에 따라오는 것이다. 저는 야구에 집중하고 팀이 좋은 성적을 거두는 것이 먼저라고 생각한다. 너무 의욕이 앞서면 조급해지는 경우를 작년에 경험했다. 개막전 이후로 이제 긴장은 안 한다. 잘하고 싶은 마음도 크지만 조금 더 편안하게 해보겠다""며 응원을 당부했다.",2025-03-25
"'두산 톱타자' 김민석 ""나만의 방식으로 팀에 도움 되고파""","(서울=연합뉴스) 하남직 기자 = 개막 2연전에서 뼈아픈 연패를 당한 두산 베어스의 팬들은 새로운 톱타자 김민석(20)을 보며 위로를 얻었다. 김민석도 ""우승팀도 한 시즌에 50번은 패한다""면서 ""다음 경기를 준비하는 게 더 건설적""이라며 앞을 보며 나아가기로 했다. 두산은 22일과 23일 인천 SSG랜더스필드에서 벌인 SSG 랜더스와의 프로야구 개막 2연전에서 모두 패했다. 외국인 원투 펀치를 내세우고도 2패를 당해 상처가 더 컸다. 하지만, 소득은 있었다. 지난해 11월 롯데 자이언츠와의 트레이드로 영입한 김민석은 개막 2연전 모두 1번 타자 좌익수로 선발 출전해 9타수 3안타, 1볼넷, 2타점을 올렸다. 타율은 0.333, 출루율은 0.400이었다. 과감하게 김민석을 1번 타자로 낙점한 이승엽 두산 감독은 ""김민석이 개막전에서 2타점 3루타를 쳤다. 우리가 기대했던 게 나왔다""고 흐뭇해했다. 23일 경기 전 만난 김민석은 ""개막전에 출전한 건 처음이었다. 확실히 긴장했고, 개막전 첫 타석에서는 타이밍을 잡지 못하고 삼진을 당했다""며 ""그래도 경기를 치르면서 점점 안정됐고, 4회에 2타점 3루타를 쳤다. 그 당시에는 좋았다""고 말했다. 22일 SSG와의 개막전 4회초 2사 1, 2루에서 김민석은 4-3으로 뒤집는 2타점 3루타를 쳤다. SSG가 6-5로 역전승하긴 했지만, 두산 김민석도 역전 3루타로 강렬한 인상을 남겼다. 3루에서 포효도 했던 김민석은 ""동점을 만들겠다는 생각으로 타석에 섰는데 역전까지 성공해 그런 동작이 나왔다""고 떠올렸다. 올 시즌 KBO리그에서는 '장타력을 갖춘' 강백호(kt wiz), 야시엘 푸이그(키움 히어로즈)가 1번 타자로 나서 화제를 모은다. 출루에 능한 홍창기(LG 트윈스)는 '전통적인 1번 타자'로 LG 타선의 선봉에 선다. 김민석은 굳이 구분하자면 '전통적인 1번 타자'에 가깝다. 김민석은 ""나는 아직 홍창기 선배, 강백호 선배와는 비교조차 할 수 없다""고 몸을 낮추며 ""나만의 방식으로 '팀에 도움이 되는 톱타자'가 되고 싶다""고 했다. 두산은 김민석에게 자신감, 과감한 스윙 등을 주문했다. 김민석은 ""경기 시작을 알리는 톱타자는 초반 팀 분위기를 좌우할 수 있다고 들었다. 매번 잘 칠 수는 없지만, 아웃이 되더라도 과감하게 스윙하겠다""며 ""물론 선구안 연구도 하고 있다. 칠 수 있는 공을 적극적으로 공략하는 게, 내가 바라는 이상적인 모습""이라고 밝혔다. 새 팀에서 톱타자로 출발한 김민석은 롯데를 향한 고마움도 잊지 않고 있다. 김민석은 ""지금은 롯데를 떠났지만, 정말 좋은 기억만 있다""며 ""롯데에서 배운 걸 잘 활용해 더 좋은 선수가 되겠다""고 다짐했다. jiks79@yna.co.kr",2025-03-25
"""처음에 솔직히 많이 긴장됐다"" 2연패 두산의 수확 '돌격대장' 김민석 [IS 피플]","SSG 랜더스와의 개막 2연전을 모두 패한 두산 베어스. 수확이 없는 건 아니었다. 2차전 선발 투수 잭 로그가 호투했고, 강승호의 타격감엔 불이 붙었다. 무엇보다 '이적생' 김민석(21)이 리드오프로 가능성을 내비쳤다는 게 희망적이다. 김민석의 올 시즌 개막 2연전 타격 성적은 9타수 3안타이다. 두 경기 모두 1번 타자·좌익수로 선발 출전, 1차전 4타수 2안타 1볼넷, 2차전에선 5타수 1안타를 기록했다. 1차전 2-3으로 뒤진 4회 초 2사 1·2루에서 때려낸 역전 2타점 3루타가 압권. 팀의 패배로 활약이 빛이 바랬지만, 이승엽 두산 감독은 ""민석이한테 기대하고 있는 부분이 충분히 나왔다""라고 흡족해했다. 지난해 11월 트레이드로 두산에 합류한 김민석은 일찌감치 1번 타자로 낙점됐다. 이승엽 감독은 주루가 뛰어난 베테랑 정수빈을 9번, 슬러거 김재환을 2번에 배치해 대량 득점을 노린다. 개막 2차전에 앞서 취재진과 만난 김민석은 ""(리드오프는) 경기의 시작을 알리는 타자로서 팀 분위기를 좌지우지할 수 있다. 매번 잘 칠 수 없기 때문에 아웃이 되더라도 자기 스윙을 하겠다. 상대 투수의 기도 눌러줄 수 있어서 초구부터 자신 있게 스윙하자는 생각""이라고 말했다. 휘문고를 졸업한 김민석은 2023년 신인 드래프트 1라운드 전체 3순위로 롯데 자이언츠에 지명됐다. 데뷔 첫 시즌인 2023년 타율 0.255(400타수 102안타) 3홈런 39타점으로 두각을 나타냈으나 이후 활약은 미미했다. 두산에서 새출발하는 그는 ""(개막전 때) 솔직히 많이 긴장했다. 첫 타구가 올 때도 헤맸던 거 같다""며 ""오랜만에 선발 출전하니까 경기가 끝난 뒤 진도 많이 빠지고 평소보다 많이 힘들었다""라고 돌아봤다. 리드오프로 공격의 활로를 뚫어야 하는 김민석은 ""(리그 대표 1번 타자로) KT 위즈 강백호 형도 있고 LG 트윈스 홍창기 선배님도 계신다. 아직 그 선배들이랑 비교가 안 되지만, 최대한 그렇게 따라갈 수 있도록 나만의 방향성과 색깔을 찾아서 유지하는 게 목표""라며 ""오로지 우리 팀이 이길 수 있는 야구가 뭔지 생각하고 최선을 다하고 있다""라고 강조했다. 김민석은 이적 후 정수빈의 뒤를 이을 '잠실 아이돌'로 불린다. 이에 대해 그는 ""야구에 집중하고 좋은 성적을 거두면 그런 건 알아서 따라온다고 생각한다""라며 몸을 낮췄다. 김민석이 경계해야 하는 건 '오버 페이스'이다. 김민석은 ""보여주고 싶은 마음이 큰데 너무 의욕이 앞서다 보면 급해지는 경우가 있다. 조급해지는 결 작년에 겪어봤다""며 ""그런 경험이 많은 교훈을 준 거 같다. 잘하고 싶은 마음은 크지만 좀 더 편안하게 하고 있다""라고 힘주어 말했다. 배중현 기자 bjh1025@edaily.co.kr",2025-03-25
"'팀에는 위기, 선수에겐 기회'→'3선발' 잡은 최원준...달라진 모습·구위, 정규시즌서도 증명할까","최원준(31·두산 베어스)에게 놓친 줄 알았던 기회가 찾아왔다. 살리는 건 그의 몫이다. 최원준은 25일 수원 KT위즈파크에서 열리는 2025 KBO리그 정규시즌 KT 위즈와 3연전 1차전에 선발로 등판한다. 시범경기 막판엔 예상할 수 없던 일이었다. 당시 그는 5선발 경쟁에 뛰어들었지만, 후배 김유성에게 패했다. 당시 이승엽 감독은 ""5선발은 유성이로 최종 결정을 내렸다. 팀에 오명진, 김민석 등 새 얼굴이 나오고 있는 상황이다. 우리 팀은 지난해와 많이 바뀌어야 하는 때""라며 ""힘 있는 유성이가 먼저 선발로 나가기로 했다. 원준이에게는 이해를 해달라고 전했다""고 설명했다. 경쟁에서 밀렸다고 최원준의 퍼포먼스가 떨어졌던 건 아니었다. 최원준은 올해 두 차례 시범경기에 등판해 7이닝 동안 1승 평균자책점 1.29 호투했다. 볼넷을 1개만 내주면서 탈삼진 4개를 잡았다. 2경기뿐이지만 이유는 있었다. 지난해까지 사이드암스로 투수였던 최원준은 비시즌 동안 과감히 팔 각도를 스리쿼터스로까지 올렸다. 잃어버린 구위를 찾기 위해서였다. 최원준은 사이드암스로 투수로 2020년 10승 2패 평균자책점 3.80, 2021년 12승 4패 평균자책점 3.30, 2022년 8승 13패 평균자책점 3.60을 기록했다. 하지만 점차 구위가 떨어졌고 2023년 평균자책점 4.93, 2024년 평균자책점 6.46으로 크게 부진했다. 3구종으로 체인지업과 포크볼을 시도했으나 각도가 작아 큰 효과를 보지 못했다. 효과는 있었다. 미국 트레드 애슬레틱스를 찾아가 팔 각도를 수정한 최원준은 평균 140㎞/h 이하였던 직구 구속을 최고 147㎞/h까지 끌어올렸다. 팔 각도가 올라가면서 포크볼의 낙차도 커졌다. 팀의 미래인 후배에게 기회를 내주긴 했으나 경쟁력은 확인했다. 기회까지 왔다. 두산은 개막 직전 국내 에이스이자 지난해 공동 다승왕(15승)인 곽빈이 왼쪽 내복사근 부분손상 진단을 받고 이탈했다. 4월 초 재진단을 받는 상황이라 최소 2~3회 이상 선발 로테이션에 공백이 생겼다. 두산으로서는 고민의 여지 없이 최원준을 대안으로 결정했다. 최원준과 곽빈은 평소 피칭 이야기를 1시간 이상 나눌 정도로 절친한 선후배 사이. 후배이자 팀 에이스인 곽빈의 공백이 크지만, 그 자리가 선배 최원준에겐 다시 기회가 됐다. '임시직'인 만큼 첫 경기 모습이 중요하다. 최원준의 상대는 언더스로 투수 고영표다. 2021년부터 2023년까지 두 자릿수 승수를 거둔 리그 대표 '잠수함 에이스'지만, 지난해엔 평균자책점 6승 8패 4.95로 고전했다. 최원준이 그를 넘어야 한다. 차승윤 기자 chasy99@edaily.co.kr",2025-03-25
