news_title,news_content,published_date
"“데뷔 첫 승 축하해, 7삼진 잡아내는 완벽한 피칭” 1차지명 좌완 유망주, SSG 위닝시리즈 이끌다 [오!쎈 인천]","[OSEN=인천, 길준영 기자] 프로야구 SSG 랜더스가 김건우(23)의 호투에 힘입어 주중 3연전 위닝시리즈를 챙겼다. SSG는 27일 인천 SSG랜더스필드에서 열린 ‘2025 신한은행 SOL Bank KBO리그’ 롯데 자이언츠와의 경기에서 5-2로 승리했다. 첫 경기를 내줬지만 이후 2연승을 질주하며 주중 3연전 위닝시리즈를 챙겼다. SSG 타선은 9안타를 몰아치며 롯데 마운드를 압박했다. 최지훈이 4타수 2안타 1타점 1득점 1볼넷으로 활약하며 팀 승리를 이끌었다. 에레디아와 한유섬도 멀티히트를 때려내며 힘을 보탰다. 선발투수 박종훈은 3⅔이닝 1피안타 4볼넷 2사구 3탈삼진 2실점으로 고전했다. 하지만 뒤이어 등판한 김건우가 4⅓이닝 1볼넷 1사구 7탈삼진 무실점 호투를 펼치며 승리의 발판을 마련했다. 김건우는 데뷔 후 처음으로 승리투수가 됐다. 9회에는 마무리투수 조병현이 1이닝을 무실점으로 막아내며 시즌 2세이브를 따냈다. 롯데에 먼저 2점을 헌납한 SSG는 4회말 선두타자 최지훈이 안타로 출루했다. 정준재는 2루수 땅볼을 쳐 선행주자가 잡혔지만 박성한이 볼넷을 골라내 1사 1, 2루 찬스를 연결했고 에레디아와 한유섬이 연달아 1타점 적시타를 터뜨리며 승부를 원점으로 되돌렸다. 이후 잠잠하던 SSG는 7회 마침내 길었던 0의 행진을 끝냈다. 선두타자 조형우가 안타로 출루했고 최지훈이 1타점 3루타를 터뜨리며 경기를 뒤집었다. 이어서 정준재 투수 내야안타, 박성한 1타점 적시타, 에레디아 1타점 내야안타가 터지며 승부에 쐐기를 박았다. 이숭용 감독은 경기 후 인터뷰에서 “(김)건우의 개인 통산 첫 승을 축하한다. 믿음에 보답하는 호투였다. 초반에 좀 흔들렸지만 피안타 없이 7개 삼진을 잡아내는 완벽한 피칭이었다”라며 김건우의 데뷔 첫 승리를 축하했다. “야수 쪽에서는 3, 4, 5번 중심타선에서 5안타 4타점이 나왔다”라고 말한 이숭용 감독은 “(한)유섬이의 멀티 안타 활약이 오늘 경기의 소득이다. (최)지훈이도 리드오프로서 좋은 활약을 보여주며 결승타를 쳤다”라고 말했다. 이어서 “팀이 힘든 상황 속에서 선수단이 경기를 거듭할수록 단합된 힘이 느껴진다. 그 원팀의 힘으로 이번 시리즈 위닝을 거둘 수 있지 않았나 싶다. 마지막으로 빗속에서도 열띤 응원을 보내주신 팬분들께 감사드린다”라고 이야기했다. 롯데와의 홈 3연전에서 2승 1패 위닝시리즈를 챙긴 SSG는 오는 28일 서울 고척 스카이돔으로 이동해 키움 히어로즈와 원정 3연전을 치른다. SSG 선발투수는 드류 앤더슨이 나선다. 키움은 케니 로젠버그가 선발투수다. /fpdlsl72556@osen.co.kr",2025-03-27
"'노히트+KKKKKKK' 1차 지명 유망주의 첫 승, 이숭용의 박수 ""믿음에 보답하는 호투, 축하한다"" [MD인천]","[마이데일리 = 인천 박승환 기자] ""건우의 개인 통산 첫 승을 축하한다"" SSG 랜더스는 27일 인천 SSG 랜더스필드에서 열린 2025 신한은행 SOL Bank KBO리그 롯데 자이언츠와 팀 간 시즌 3차전 홈 맞대결에서 5-2로 짜릿한 역전승을 거두며, 유통 더비에서 위닝시리즈를 거뒀다. 이날 SSG는 경기 초반 롯데에게 기선제압을 당했다. 5선발 박종훈이 3회 윤동희와 정훈에게 연속 볼넷을 내주면서 위기를 자초했고, 빅터 레이예스에게 희생플라이를 허용한 까닭. 그리고 4회에는 박승욱에게 몸에 맞는 볼을 내준 뒤 도루까지 허용하면서 만들어진 2사 2루에서 정보근에게 적시타를 맞아 0-2로 끌려갔다. 하지만 타선의 활약에 경기는 순식간에 원점이 됐다. 4회말 정준재가 2루수 땅볼로 출루, 박성한의 볼넷으로 만들어진 첫 번째 찬스에서 기예르모 에레디아와 한유섬이 연속 적시타를 터뜨리며 경기는 순식간에 2-2로 균형이 맞춰졌다. 그리고 SSG는 선발 박종훈이 내려간 뒤 '5선발 후보'였던 김건우를 투입했는데, 5~7회 롯데 타선을 모두 삼자범퇴로 돌려세우는 등 8회에도 마운드에 올라 무실점의 탄탄한 투구를 선보이며 역전의 발판을 마련했다. 이에 타선도 응답했다. SSG는 7회말 공격에서 조형우가 롯데의 바뀐 투수 박준우를 상대로 안타를 터뜨리며 물꼬를 틀더니, 최지훈이 우중간을 가르는 1타점 2루타를 폭발시켰다. 그리고 정준재의 내야 안타 등으로 만들어진 2, 3루 찬스에서 박성한과 기예르모 에레디아가 연속 적시타를 폭발시키며 어느새 간격은 5-2까지 벌어졌다. 그리고 뒷문까지 확실히 단속했다. 이숭용 감독은 전날(26일) 마무리 조병현에게 확실한 휴식을 부여했는데, 이날은 정상적으로 마운드에 오를 수 있는 상황이 마련됐다. 이에 사령탑은 조병현을 마무리로 투입했고, 9회초 수비를 실점 없이 매듭지으며 '유통라이벌' 맞대결을 위닝시리즈로 장식했다. 이날 마운드에서는 박종훈에 이어 마운드에 오른 김건우가 4⅓이닝 동안 투구수 65구, 1볼넷 7탈삼진 무실점으로 '노히트' 투구를 선보이며 첫 승을 손에 넣었고, 타선에서는 최지훈이 4타수 2안타 1타점 1득점 1볼넷, 에레디아가 2안타 2타점, 박성한이 1안타 1타점 1득점 2볼넷으로 존재감을 드러냈다. 경기가 끝난 뒤 이숭용 감독은 ""(김)건우의 개인 통산 첫 승을 축하한다. 믿음에 보답하는 호투였다. 초반에 좀 흔들렸지만 피안타 없이 7개 삼진을 잡아내는 완벽한 피칭이었다""고 인생투를 펼친 김건우를 향해 극찬을 쏟아냈다. 이어 사령탑은 ""야수 쪽에서는 3, 4, 5번 중심타선에서 5안타 4타점이 나왔다. (한)유섬이의 멀티 안타 활약이 오늘 경기의 소득이다. (최)지훈이도 리드오프로서 좋은 활약을 보여주며 결승타를 쳤다""고 타선의 활약에도 엄지를 치켜세웠다. 끝으로 이숭용 감독은 ""팀이 힘든 상황 속에서 선수단이 경기를 거듭할수록 단합된 힘이 느껴진다. 그 원팀의 힘으로 이번 시리즈 위닝을 거둘 수 있지 않았나 싶다""며 ""마지막으로 빗속에서도 열띤 응원을 보내주신 팬분들께 감사드린다""고 힘주어 말했다.",2025-03-27
"""믿음에 보답, 완벽했다!"" 데뷔 5년만의 1군 첫승…'7K+노히트' 좌완 영건 향한 사령탑의 폭풍칭찬 [인천승장]","[인천=스포츠조선 김영록 기자] ""안타 없이 삼진 7개를 잡아냈다. 완벽한 피칭이었다."" 사령탑이 환하게 웃었다. 필승조에게 전원 휴식을 준 날, 5년차 신예 좌완에겐 말 그대로 '스타 탄생'의 하루였다. SSG 랜더스는 27일 인천 SSG랜더스필드에서 열린 롯데 자이언츠전에서 5대2로 승리, 주중시리즈 2승1패 위닝을 달성했다. 개막 이후 4승1패의 상승세다. 이날 선발 맞대결에선 조금 밀렸다. 5선발 경쟁에서 앞선 박종훈이 출격했지만, 4회를 채우지 못하고 2실점한 뒤 교체됐다. 피안타는 1개 뿐이었지만, 무려 6개의 4사구를 허용하며 장점이던 제구력에 문제를 드러냈다. 그 아쉬움을 5년차 신예 김건우가 완벽하게 메웠다. 김건우는 4⅓이닝 동안 안타 없이 4사구 2개만 허용하며 롯데 타선을 꽁꽁 묶었다. 총 투구수도 65개로 적절했다. 최고 148㎞ 직구(47개)를 앞세워 삼진 7개를 잡아냈다. 체인지업(16개) 슬라이더(2개)의 배합이 눈부셨다. 특히 8회말 선두타자 나승엽에게 몸에맞는볼로 무사 1루가 됐지만, 레이예스를 상대로 6연속 직구 승부 끝에 병살처리하는 자존감도 돋보였다. 2021년 1차 지명으로 SK 와이번스(SSG의 전신)에 입단한 이래 5년만에 거둔 데뷔 첫승이다. 경기 후 인터뷰를 마친 김건우에겐 수많은 동료 선후배들이 달려들어 물폭탄 신고식을 선사했다. 경기 후 이숭용 SSG 감독은 ""김건우의 개인 통산 첫승을 축하한다. 믿음에 보답하는 호투였다. 초반에 좀 흔들렸지만 피안타 없이 7개 삼진을 잡아내는 완벽한 피칭""이라며 뜨거운 찬사를 보냈다. 이어 ""야수 쪽에서는 3,4,5번 중심타선에서 5안타 4타점이 나왔다. 한유섬의 멀티 안타 활약이 오늘 경기의 소득이다. 최지훈도 리드오프로서 좋은 활약을 보여주며 결승타를 쳤다""고 덧붙였다. ""팀이 힘든 상황 속에서 선수단이 경기를 거듭할수록 단합된 힘이 느껴진다. 그 원팀의 힘으로 이번 시리즈 위닝을 거둘 수 있었다. 빗속에서도 열띤 응원을 보내주신 팬분들께 감사드린다.""",2025-03-27
"'4년 기다렸다' SSG 김건우, 첫 승이 노히터라니... 사령탑 ""믿음에 보답한 호투, 7탈삼진 완벽한 피칭"" 극찬 [인천 현장]","[스타뉴스 | 인천=안호근 기자] 4승 1패. 5선발 경쟁에서 탈락한 투수의 완벽한 투구와 데뷔 첫 승리. SSG 랜더스가 짜릿한 승리를 챙겼다. 선발 투수가 조기강판한 뒤에도 1+1 선발이 기대를 웃도는 완벽한 투구로 기분 좋은 상승세를 이어갔다. SSG는 27일 인천 SSG랜더스필드에서 열린 롯데 자이언츠와 2025 신한 SOL뱅크 KBO리그 홈경기에서 5-2로 승리를 챙겼다. 5강권 후보로 주목을 받지 못했고 KBO 통산 홈런 1위 타자 최정과 외국인 투수 미치 화이트가 빠진 상황에서도 이뤄낸 승리라 더욱 뜻 깊다. 김건우(23)의 활약이 눈부셨다. 선발 경쟁에서 승리한 박종훈이 기회를 잡았지만 3⅔이닝 만에 2실점하며 물러났고 4회 2사 1루에서 구원 등판했다. 당초에 김건우 카드를 1+1 카드로 준비해뒀던 이숭용 감독이었다. 개막전에서 아웃카운트를 하나도 잡아내지 못하고 볼넷만 2개를 허용하며 고개를 떨궜던 김건우는 누구도 예상치 못한 만점짜리 투구를 뽐냈다. 첫 타자에게 볼넷을 허용했으나 그게 이날 롯데가 김건우를 상대로 만들어낸 유일한 출루였다. 이후 정훈을 삼진으로 돌려세우며 실점 위기를 지운 김건우는 5,6,7,8회를 모두 삼자범퇴로 끝냈다. 최고 시속 148㎞의 패스트볼과 10㎞ 가량 차이를 보이는 체인지업 위주의 사실상 투피치였으나 롯데 타선은 꼼짝 없이 당했다. 삼진을 무려 7개나 잡아내며 압도했다. 2021년 SK 와이번스(SSG 전신)의 마지막 1차 지명자로 기대를 안겨주며 입단했으나 팔꿈치 수술을 받고 국군체육부대(상무)를 거쳐 지난해 9월 복귀해 올 시즌 전까지 1군 경험이 8경기 14이닝이 전부였다. 올 시즌을 앞두고 스프링캠프부터 사령탑의 호평을 받았던 김건우는 시범경기에서 완벽한 투구에 이어 SSG의 미래를 책임질 좌완이라는 걸 증명해냈다. 경기 후 이숭용 감독은 ""(김)건우의 개인 통산 첫 승을 축하한다. 믿음에 보답하는 호투였다""며 ""초반에 조금 흔들렸지만 피안타 없이 7개의 삼진을 잡아내는 완벽한 피칭이었다""고 칭찬했다. 타선의 활약도 빛났다. 3회와 4회 박종훈이 실점하며 0-2로 끌려갔으나 4회말 최지훈의 안타, 박성한의 볼넷에 이어 기예르모 에레디아와 한유섬이 모처럼 중심 타선의 역할을 해내는 적시타를 날렸다. 타자들의 고른 활약으로 역전을 만들어냈다. 이날 시즌 첫 출장한 포수 조형우가 7회말 선두 타자로 나서 중전 안타로 출루했고 최지훈이 승부를 뒤집는 1타점 3루타를 때려냈다. 정준재의 내야 안타에 이어 박성한과 에레디아가 승부에 쐐기를 박는 귀중한 적시타를 연달아 터뜨렸다. 이날 SSG는 11안타와 3볼넷을 묶어 5득점했는데 8명의 타자에게서 고루 안타가 나왔다. 특히나 그동안 활약이 아쉬웠던 중심 타선의 활약이 반가웠다. 이 감독은 ""야수 쪽에서는 3,4,5번 중심 타선에서 5안타 4타점이 나왔다. (한)유섬이의 멀티 안타 활약이 오늘 경기의 소득이다. (최)지훈이도 리드오프로서 좋은 활약을 보여주며 결승타를 쳤다""고 엄지를 치켜세웠다. 4승 1패, 5연승을 달린 LG 트윈스에 이어 단독 2위로 쾌조의 출발을 보이고 있다. 이 감독은 ""팀이 힘든 상황 속에서 선수단이 경기를 거듭할수록 단합된 힘이 느껴진다""며 ""그 원팀의 힘으로 이번 시리즈 위닝을 거둘 수 있지 않았나 싶다. 마지막으로 빗속에서도 열띤 응원을 보내주신 팬분들께 감사드린다""고 말했다.",2025-03-27
"‘4승1패 단독 2위’ 이숭용 SSG 감독의 함박 웃음 “김건우의 개인 통산 첫승 축하, 믿음에 보답하는 호투”[스경X현장]",SSG가 롯데와의 주중 3연전을 위닝시리즈로 마쳤다. SSG는 27일 인천SSG랜더스필드에서 열린 롯데와의 홈경기에서 5-2로 승리했다. 이날 승리로 4승1패를 기록한 SSG는 단독 2위에 자리했다. 두번째 투수 김건우의 역투가 빛났다. SSG 박종훈은 3.2이닝 1안타 4볼넷 3삼진 2실점으로 조기 강판됐다. 두번째 투수 김건우가 4.1이닝 1볼넷 7삼진 무실점으로 호투하며 팀의 승리를 이끌었다. 김건우는 데뷔 후 첫 승리를 올렸다. 선취점은 롯데가 먼저 뽑아냈다. 3회초 선두타자 윤동희가 볼넷을 얻어낸 뒤 정훈도 볼넷을 골라 무사 1·2루를 만들었다. 나승엽이 투수 땅볼로 아웃되면서 주자들은 2·3루로 진루했다. 그리고 빅터 레이예스 중견수 희생플라이로 3루주자 윤동희를 불러들이면서 선취점을 뽑아냈다. 롯데는 4회에도 1사 후 박승욱이 몸에 맞는 볼로 출루하면서 기회를 잡았다. 전민재 타석 때 2루 도루를 성공한 박승욱은 정보근의 중전 적시타로 홈인할 수 있었다. SSG는 4회말 바로 반격했다. 선두타자 최지훈이 중전 안타로 출루했다가 후속타자 정준재의 2루 땅볼 때 아웃됐다. 그러나 박성한이 볼넷을 얻어내면서 다시 기회를 살리기 시작했다. 그리고 길예르모 에레디아가 좌전 적시타를 쳐 한 점을 따라잡았다. 이어 한유섬까지 우전 적시타를 뽑아내 2-2 동점을 만들었다. 2-2의 팽팽한 균형은 7회말에 깨졌다. 롯데는 박준우가 마운드에 올랐다. 조형우가 중전 적시타를 쳤고 이어 최지훈이 우중간 2루타를 치며 1루 대주자 최상민을 불러들였다. SSG는 3-2로 앞섰다. 최지훈은 상대 우익수 윤동희가 포구 실책을 하는 틈을 타 3루까지 내달렸다. 이어 정준재가 내야 안타로 출루에 성공했고 박성한이 우전 적시타를 쳤다. 이어 에레디아도 3루수 방면 내야 안타로 1루를 밟으며 살아남았고 3루에 있던 정준재가 홈인하며 점수는 5-2로 더 벌어졌다. SSG는 9회 마무리 조병현을 올려 경기를 끝냈다. 경기 후 이숭용 SSG 감독은 “김건우의 개인 통산 첫승을 축하한다. 믿음에 보답하는 호투였다. 초반에 좀 흔들렸지만 피안타 없이 7개 삼진을 잡아내는 완벽한 피칭이었다”라고 칭찬했다. 이어 “야수 쪽에서는 3~5번 중심타선에서 5안타 4타점이 나왔다. 한유섬의 멀티 안타 활약이 오늘 경기의 소득이다. 최지훈이도 리드오프로서 좋은 활약을 보여주며 결승타를 쳤다”고 짚었다. 이 감독은 “팀이 힘든 상황 속에서 선수단이 경기를 거듭할수록 단합된 힘이 느껴진다. 그 원팀의 힘으로 이번 시리즈 위닝을 거둘 수 있지 않았나 싶다”며 선수단 전체를 추켜세웠다. 그러면서 “마지막으로 빗속에서도 열띤 응원을 보내주신 팬분들께 감사드린다”고 덧붙였다. 인천 | 김하진 기자 hjkim@kyunghyang.com,2025-03-27
‘김건우 1+1 카드’도 적중…흔들리지 않는 편안함 ‘철벽 불펜’ SSG,"인천 = 정세영 기자 개막 초반 SSG의 불펜진이 예사롭지 않다. SSG는 양적으로나, 질적으로나 풍부한 투수진을 적소에 배치하고 적시에 투입한 계투작전이 빛을 발휘하고 있다. 그리고 이번엔 ‘1+1 전략’이 적중했다. SSG는 27일 인천SSG랜더스필드에서 열린 2025 신한 쏠(SOL) 뱅크 KBO리그 롯데와의 홈경기에서 5-2로 이겼다. 전날에 이어 이틀 연속 승리를 챙긴 SSG는 시즌 4승째(1패)를 챙겼다. 승리의 일등 공신은 선발 박종훈에 이어 마운드에 오른 좌완 김건우였다. 김건우는 올해 스프링캠프에서 정동윤, 송영진 등과 5선발 경쟁을 펼쳤다. 올해 시범경기에선 2경기에 나서 7이닝 1실점으로 5선발 후보 중 가장 빼어난 성적을 남겼다. 그러나 이 감독은 김건우에게 5선발이 아닌 선발 투수 바로 다음에 붙는 ‘+1 카드’를 맡겼다. 미치 화이트의 부상 이탈 등 선발 자리에 비어 있는 상황에서, 구위를 확인한 김건우가 +1 카드로 더 안성맞춤일 것이라는 판단 때문. 그런데 김건우는 시즌 첫 등판에선 부진했다. 22일 인천 두산전에서 4번째 투수로 마운드에 오른 김건우는 사사구 2개를 내주며 1실점하며 흔들렸다. 하지만 이날은 달랐다. 선발 박종훈이 3.2이닝 동안 사사구 6개를 내주며 흔들렸고, 이 감독은 박종훈에 이어 곧바로 김건우 카드를 꺼냈다. 김건우는 이 감독의 기대에 100% 부응했다. 4회 첫 타자 윤동희에게 볼넷을 내줬지만, 이후 4.1이닝을 무안타로 롯데 타선을 꽁꽁 묶었다. 특히 최고 시속 148㎞까지 찍힌 묵직한 직구(47개)에 체인지업(16개), 슬라이더(2개) 등을 골고루 섞어 던지며 7개의 삼진을 뺏어냈다. 이 감독은 경기 뒤 ""김건우의 개인 통산 첫 승리를 축하한다. 믿음에 보답하는 호투였다. 초반에 좀 흔들렸지만 피안타 없이 7개 삼진을 잡아내는 완벽한 투구였다""고 칭찬을 아끼지 않았다. 시즌 초반 SSG의 불펜진은 견고하게 돌아간다. 강점인 불펜으로 약점인 선발을 보완하는 형태로 마운드를 운용해 상대가 반격할 틈조차 허용하지 않고 있다. 26일까지 팀 불펜진의 평균자책점은 0.55. 마무리 조병현과 지난해 최고령 홀드왕 노경은이 건재하고, 비시즌 트레이드로 영입한 김민이 ‘환상의 필승조’를 구축했다. 여기에 지난해보다 한층 성장한 이로운과 한두솔까지 가세하며 불펜 뎁스는 더욱 두터워졌다는 평가다. 이날 생애 첫 승리를 챙긴 김건우는 경기 뒤 동료들의 물세례까지 받았다. 김건우는 ""첫 승이 아직 믿기지 않고, 제가 5년 동안 프로 생활하면서 승이 없었지만, 마운드 올라갔을 때는 전혀 그런 생각이 안 들었다. 팀이 어떻게든 승리할 수 있게 이끌고 싶었다. 절대 분위기를 안 넘기겠다는 생각으로 던졌고, 좋은 투구가 나왔던 것 같다""고 환하게 웃었다. 5선발이 아닌 불펜에서 뛰는 것은 두고 ""전혀 아쉬움은 없다. 나는 중간에서 분위기 안 뺏기게 잘하는 선수가 되겠다""면서 ""중간으로 계속 나가면 팀의 리드를 안 내주는 선수가 되겠다. 승리보다는 100이닝, 풀타임 투수가 되는 것이 목표""라고 힘주어 말했다.",2025-03-27
"롯데 상대 위닝시리즈 거둔 이숭용 감독 ""김건우, 완벽한 피칭…믿음에 보답"" [IS 승장]","SSG 랜더스가 투타 조화를 앞세워 연승에 성공했다. SSG는 27일 인천SSG랜더스필드에서 열린 롯데 자이언츠와의 홈 경기를 5-2로 승리했다. 3연전 중 1차전을 패한 SSG는 2·3차전을 모두 챙기며 '위닝시리즈'를 가져갔다. 시즌 4승 1패. 반면 1차전 승리의 상승세를 이어가지 못한 롯데는 시즌 4패(1승)째를 당했다. 4회 초까지 0-2로 끌려간 SSG는 4회 말 1사 1·2루에서 터진 에레디아와 한유섬의 연속 적시타로 동점을 만들었다. 승부에 쐐기를 박은 건 7회 초였다. 선두타자 9번 조형우부터 4번 에레디아까지 5연속 안타로 3득점, 5-2로 점수 차를 벌렸다. 결승타는 2-2로 맞선 무사 1루에서 우중간을 가르는 1타점 3루타를 때려낸 최지훈의 몫이었다. 이날 SSG는 두 번째 투수 김건우가 4와 3분의 1이닝 2사사구 7탈삼진 무실점하며 2021년 데뷔 후 첫 승을 따냈다. 0-2로 뒤진 4회 초 2사 1루에서 구원 등판해 흠잡을 곳 없는 피칭으로 롯데 타선을 압도했다. 타선에선 최지훈(4타수 2안타 1타점) 에레디아(4타수 2안타 2타점) 한유섬(4타수 2안타 1타점)이 각각 멀티히트를 해냈다. 이숭용 SSG 감독은 경기 뒤 ""건우의 개인 통산 첫 승리를 축하한다. 믿음에 보답하는 호투였다. 초반에 좀 흔들렸지만 피안타 없이 7개 삼진을 잡아내는 완벽한 피칭이었다""며 ""야수 쪽에서는 3,4,5번 중심타선에서 5안타 4타점이 나왔다. 유섬이의 멀티 안타 활약이 오늘 경기의 소득이다. 지훈이도 리드오프로서 좋은 활약을 보여주며 결승타를 쳤다""라고 흡족해했다. 이어 ""팀이 힘든 상황 속에서 선수단이 경기를 거듭할수록 단합된 힘이 느껴진다. 그 원팀의 힘으로 이번 시리즈 위닝을 거둘 수 있지 않았나 싶다""며 ""마지막으로 빗속에서도 열띤 응원을 보내주신 팬분들께 감사드린다""라고 말했다. 인천=배중현 기자 bjh1025@edaily.co.kr",2025-03-27
