news_title,news_content,published_date
"‘KKKKKK’ 21살 영건 향해 쏟아진 찬사, 이숭용 감독 마음에 팍팍 꽂았다 [오!쎈 인천]","[OSEN=인천, 길준영 기자] 프로야구 SSG 랜더스 이숭용 감독이 전날 빼어난 호투를 보여준 송영진(21)을 보며 미소를 감추지 못했다. 이숭용 감독은 27일 인천 SSG랜더스필드에서 열리는 ‘2025 신한은행 SOL Bank KBO리그’ 롯데 자이언츠와의 경기 전 인터뷰에서 “어제 (송)영진이의 투구는 거의 완벽했다. 보는 내내 흐뭇했다”라고 말했다. 송영진은 지난 26일 롯데전에 선발등판해 6⅓이닝 6피안타 1볼넷 6탈삼진 1실점 승리를 기록했다. 7회까지 마운드를 지키며 선발투수로서 역할을 다했고 SSG는 3-1로 승리하며 주중 3연전 균형을 맞췄다. 송영진은 경기 후 인터뷰에서 “내가 2군에서도 안좋은 투구를 해서 감독님이 자신감이 떨어진 것이 아닌지 물어보셨다. 그래서 아니라고 대답하고 시즌 때 확실히 보여드리겠다고 말씀드렸다. 감독님께서 자신에게 꽂히는 모습을 보여달라고 하셨다”라며 이숭용 감독과의 이야기를 공개했다. “팍팍 꽂혔다”라며 활짝 웃은 이숭용 감독은 “예전에는 자기 자신과 싸우는 느낌이었는데 어제는 타자와 싸우는 느낌이 들었다. 밖에서 봐도 좋아진 모습이 보였다. 시범경기 내내 지적을 했는데 자극이 됐는지 정말로 시즌에 들어가니까 달라졌다. 자신의 말을 지켰다”라고 송영진에게 칭찬을 아끼지 않았다. 시즌 3승 1패 승률 .750을 기록하며 리그 공동 2위를 달리고 있는 SSG는 4경기가 모두 3점차 이내 접전 상황으로 전개됐다. 이 때문에 노경은, 김민 등 필승조 투수들이 전 경기에 등판하는 등 불펜 소모가 심했다. “오늘은 (노)경은이, (김)민이, (이)로운이 모두 푹쉬게 할 것”이라고 밝힌 이숭용 감독은 “4경기가 모두 타이트했다. 불펜투수들이 모두 잘 막아준 덕분에 3승 1패를 할 수 있었다. 또 (김)광현이, (문)승원이, 영진이 모두 힘을 내준 덕분이다. 그래서 타격이 조금 가라앉았지만 3승 1패를 하고 있지 않나 싶다”라며 역투하고 있는 투수들을 격려했다. SSG는 이날 최지훈(중견수)-정준재(2루수)-박성한(유격수)-기예르모 에레디아(좌익수)-한유섬(지명타자)-하재훈(우익수)-고명준(1루수)-박지환(3루수)-조형우(포수)로 선발 라인업을 구성했다. 선발투수는 박종훈이다. 이숭용 감독은 “일단은 (박)종훈이가 선발이지 않나. 상황을 봐야 한다. 뒤에 (김)건우, (정)동윤이 모두 준비를 하고 있다. 우선은 종훈이가 좋은 투구를 보여줄 것으로 기대하고 있다. 그 이후에는 상황에 따라 움직여야 할 것 같다. 오늘은 필승조 3명이 쉬기 때문에 종훈이가 오래 가면 갈수록 좋다”라며 박종훈의 호투를 기대했다. /fpdlsl72556@osen.co.kr",2025-03-27
"""팍팍 꽂혔습니다!"" 시범경기 내내 부진하던 21세 영건의 대반전, 웃음꽃 만개한 이숭용 감독 [MD인천]","[마이데일리 = 인천 박승환 기자] ""팍팍 꽂혔습니다"" SSG 랜더스 송영진은 지난 26일 인천 SSG 랜더스필드에서 열린 2025 신한은행 SOL Bank KBO리그 롯데 자이언츠와 홈 맞대결에 선발 등판해 6⅓이닝 동안 투구수 83구, 6피안타 1볼넷 6탈삼진 1실점(1자책)을 기록, 시즌 첫 승을 손에 넣었다. 그야말로 최고의 투구였다. 송영진은 1회 시작부터 황성빈에게 안타를 맞는 등 1사 3루의 위기에서 손호영을 삼진, 빅터 레이예스를 유격수 땅볼로 돌려세우며 무실점 스타트를 끊었다. 그리고 2~3회 롯데 타선을 삼자범퇴로 돌려세운 후 4회에도 이렇다 할 위기 없이 수비를 마치며 순항했다. 송영진은 5회 전준우와 전민재에게 연속 아낱를 맞으면서 찾아온 위기에서 정보근에게 적시타를 맞으면서 한 점을 내줬으나, 이후 추가 실점 없이 이닝을 매듭지었다. 그리고 6회 병살타를 곁들이며 무실점을 기록한 송영진은 내친김에 7회에도 마운드에 올랐고, 한 개의 아웃카운트를 생산한 뒤 교체됐다. 6⅓이닝 투구는 송영진이 데뷔한 이후 소화한 가장 긴 이닝. 그리고 바통을 이어받은 이로운이 실점 이닝을 무실점으로 매듭지으면서 승리 요건이 갖춰졌고, SSG가 롯데를 상대로 2점차 승리를 거두면서, 시즌 첫 등판이 승리로 이어졌다. 이숭용 감독은 송영진의 투구를 어떻게 봤을까. 사령탑은 27일 경기에 앞서 송영진에 대한 질문에 ""거의 완벽했다. 보는 내내 흐뭇했다. 밖에서 봤을 때 예전에는 자신과 싸우는 느낌이었는데, 이제는 상대와 싸우는 느낌이 들더라. 밖에서 봐도 그게 발전하지 않았나 생각하고, 본인에게 물어봐도 그 이야기를 하더라""고 엄지를 치켜세웠다. 정규시즌을 준비하는 내내 부진했던 송영진, 이에 이숭용 감독은 뼈가 있는 농담을 건네곤 했었다. 사령탑은 ""시범경기 내내 지적을 조금 했는데, 그게 자극이 됐는지, 열심히 했다. (송)영진이가 내게 '게임 들어가면 달라질 겁니다. 잘하겠습니다'라고 했는데, 그걸 지켰다""며 ""팍팍 꽂혔다. 어제가 우리가 원하는 그림이었는데, 너무 잘 던져줬다""고 활짝 웃었다. 사령탑은 3년차를 맞은 송영진이 앞으로 더 좋은 모습을 보여줄 수 있을 것이라 확신했다. 그는 ""작년에 (박)종훈이가 선발로 들어갔다가 안 됐을 때 (송)영진이로 바꾼 것은 올 시즌을 생각한 것도 있었다. 그걸 본인이 이겨냈다. 시범경기 내내 그렇게 애를 태우더니, 본 게임에 들어가서 완전히 다른 사람이 됐는데, 뿌듯했다""고 말했다. 이어 이숭용 감독은 ""표현은 하지 않았지만, (시범경기 기간에) 조금 그랬다. 하지만 본 게임을 하면 달라질 것이라는 생각이 있었다. 이전엔 한 번에 무너지는 게 있었는데, 안타를 맞고 주자가 있어도 본인의 피칭을 하는 걸 보고 '더 좋아지겠구나'라는 생각이 들었다""고 재차 기쁜 마음을 드러냈다. 한편 이날 SSG는 최지훈(중견수)-정준재(2루수)-박성한(1루수)-기예르모 에레디아(좌익수)-한유섬(지명타자)-하재훈(우익수)-고명준(1루수)-박지환(3루수)-조형우(포수) 순으로 이어지는 선발 라인업을 구성했다.",2025-03-27
"SSG 불펜, 개막 4경기 평균자책점 0.55 '철벽방어'...노경은·이로운·한두솔·김민 '필승조 총출동'","한국프로야구 2025 KBO리그가 개막한 가운데 SSG 랜더스 불펜진이 강력한 힘을 발휘하며 팀의 상승세를 이끌고 있다. 개막 4경기 동안 SSG는 3승 1패로 기분 좋게 시즌을 출발했으며, 투수진 전체 평균자책점 2.37로 LG 트윈스(1.00)에 이어 리그 2위를 기록 중이다. 특히 주목할 만한 점은 SSG 불펜진의 압도적인 성적이다. 26일 현재 SSG 불펜의 평균자책점은 0.55(16⅓이닝 15피안타 2실점 1자책)로 리그 1위를 달리고 있으며, 2위 kt wiz(2.45)와도 큰 격차를 보이고 있다. 이숭용 SSG 감독은 시즌 시작 전 ""불펜에서 믿고 맡길 투수가 늘었다""고 언급했는데, 실제로 선발과 마무리 조병현 사이에서 김민, 노경은, 이로운, 한두솔이 안정적인 릴리프 피칭을 선보이고 있다. 현재까지 SSG 불펜에서 실점한 투수는 시즌 첫 등판의 부담을 이겨내지 못한 김건우(1실점)와 마무리 조병현(1실점 비자책)뿐이다. 지난해 홀드왕 노경은은 여전히 건재함을 과시하며 4경기에 모두 등판해 1세이브 1홀드를 기록했다. 40대에 접어든 나이에도 불구하고 안정적인 투구로 팀의 뒷문을 든든히 지키고 있다. 고졸 3년 차 이로운은 지난해 63경기 등판에서 1승 3패, 1세이브, 9홀드, 평균자책점 5.95로 기대에 미치지 못했지만, 올해는 3경기 3이닝 1피안타 무실점으로 호투하며 필승조로 자리매김했다. 왼손 불펜 한두솔은 25일 롯데 자이언츠전에서 ⅓이닝 동안 3안타를 허용하며 위기를 맞기도 했지만, 실점 없이 위기를 넘겼고 현재 3경기 2이닝 무실점을 기록 중이다. 지난 스토브리그에서 kt로부터 영입한 김민은 SSG 불펜 강화의 핵심 요소로 자리잡았다. 그는 올 시즌 4경기에 모두 등판해 3⅔이닝 4피안타 무실점으로 2홀드를 기록하며 특히 25일 롯데전에서 1사 만루 위기 상황에서 병살타를 유도해 팀의 승리에 크게 기여했다. 지난해 SSG의 불펜 평균자책점은 5.25로 10개 구단 중 7위에 그쳤지만, 이숭용 감독은 ""올해 우리 필승조는 다른 팀에 밀리지 않는다""고 자신했으며, 시즌 초반 4경기를 통해 그 자신감이 결코 허언이 아님을 증명하고 있다.",2025-03-27
"‘4G 연속 무실점’ 어느새 2홀드 수확한 SSG 김민, 팀 불펜 운영에 숨 쉴 공간 제조","불펜 운영에 숨통을 트이게 했다. SSG 랜더스는 지난해 11월 KT 위즈와 함께 깜짝 트레이드 소식을 전했다. 선발 자원인 좌완 오원석(24)을 내주는 대신 우완 불펜투수 김민(26)을 영입하는 1대1 트레이드였다. 불펜을 보강해야 했던 SSG로선 김민의 합류가 무척이나 반가웠다. 다만 반대급부로 내준 카드가 만만치 않았다. 팀에서 오랜 기간 선발투수로 크게 성장하기를 바라며 공을 들인 오원석이라, 적지 않은 기회비용이 발생했다. SSG가 과감한 투자를 통해 김민을 영입한 것은 새 시즌 불펜 강화가 그만큼 중차대한 과제였기 때문이다. 지난해 SSG 불펜에서 핵심적 역할을 한 투수는 노경은, 문승원, 조병현 정도였다. 게다가 문승원이 올해 선발로 이동하면서 불펜에는 큰 구멍이 뚫렸다. SSG로선 즉각적으로 공백을 메워야 했다. 조병현이 마무리투수로 나서면서 중간에서 허리 역할을 해줄 수 있는 ‘검증된 카드’는 사실상 노경은만 남게 됐다. 다행히 올 시즌 서진용과 이로운이 좋은 출발을 보이고 있지만, 확실한 불펜 자원의 추가는 새 시즌을 앞둔 SSG에 반드시 필요했다. 김민의 합류로 불펜 운영에 숨통이 트이게 된 이유다. 김민은 구단의 기대대로 27일까지 제 기량을 발휘하고 있다. 시즌 개막 이후 4경기에 등판해 모두 무실점 피칭을 하며 2홀드, 평균자책점(ERA) 0.00을 기록 중이다. 22~23, 25~26일 연투를 펼쳤음에도 피로도는 전혀 보이지 않았다. 김민의 가세로 SSG의 불펜 운영은 한층 여유로워졌다. 우선 확실한 우완 카드 3명이 있다 보니 서로의 빈 자리를 메우기가 매우 쉬워졌다. 25일 인천 롯데 자이언츠전에서 1.1이닝 1실점(비자책)을 기록하며 27개의 공을 던진 조병현이 26일 롯데전에는 등판하기 어려웠는데, 노경은이 마무리투수로 나서서 팀의 3-1 승리를 지켰다. 김민은 26일 8회초 셋업맨으로 등판해 1이닝 무실점을 마크했다. 올해 반등을 바라는 다른 투수들도 부담을 덜고 마운드에 오르고 있다. 7~9회에 언제든 강력한 우완 불펜 3명을 내보낼 수 있으니, 앞선 6회에는 이로운, 서진용, 한두솔 등으로 막을 수 있다. 위기 상황 대처도 원활하게 이뤄지고 있다. SSG는 외국인투수 미치 화이트의 햄스트링 부상 이탈로 시즌 초반 선발진 운영에 비상이 걸렸다. 이숭용 감독은 시즌 초반부터 불펜을 빠르게 가동하겠다는 의사를 밝혔는데, 김민이 없었다면 이 같은 초반 총력전은 쉽지 않았을 것으로 보인다. 불펜 보강의 위력을 새삼 재확인할 수 있는 대목이다.",2025-03-27
"SSG가 세금을 현명하게 내는 법… 대화와 가르침, 현재와 미래 모두 잡는다","[스포티비뉴스=인천, 김태우 기자] SSG는 26일 인천SSG랜더스필드에서 열린 롯데와 경기에서 선발 송영진을 비롯한 마운드의 릴레이 호투가 이어지며 3-1로 이기고 전날(25일) 연장 패배를 설욕했다. 개막 직후 4경기에서 3승1패라는 좋은 성적을 거둔 선수단 분위기는 좋았다. 대체로 밝은 표정으로 더그아웃을 빠져 나가 클럽하우스로 향했다. 그런데 예외인 선수가 하나 있었으니 팀의 주전 2루수로 발돋움한 정준재(22)였다. 정준재는 이날 2루타 하나를 포함해 4타수 2안타를 기록했다. 표면적으로 보면 나쁘지 않은, 어쩌면 좋은 하루였다. 그러나 경기 내용에서 아쉬운 점이 적지 않았다. 잡을 수도 있었던 파울 플라이를 놓쳤고, 욕심을 내 오버런을 하다 횡사한 장면도 있었다. 꼭 이날 경기뿐만 아니라 시즌 개막 이후 아슬아슬한 장면들이 여러 차례 나오며 냉탕과 온탕을 오가고 있다. 정준재는 바로 클럽하우스로 들어가지 않고, 손시헌 1군 수비코치와 여러 가지 대화를 나눴다. 거의 대다수 선수들이 퇴장한 가운데 더그아웃 한켠에 나란히 앉아 이날 경기를 복기하고 있었다. 주제는 베이스에서의 리드 폭 등 다양했다. 손 코치는 상황을 다시 돌아보면서 자신의 생각을 설명하고, 그 상황에서는 어떤 플레이를 해야 하는지를 꼼꼼하게 이야기했다. 정준재도 마냥 듣고 있기만 하기 보다는 자신의 생각을 이야기하면서 접점을 찾아가고 있었다. 혼내는 분위기가 아니었다. 다시 그런 실수를 하지 않기 위한 노력이었다. 손 코치는 정준재와 대화를 나눌 수 있는 적임자다. 지난해 퓨처스팀(2군) 감독으로 부임했고, 정준재는 지난해 신인드래프트를 통해 입단했다. 퓨처스팀 전지훈련부터 정준재가 1군에 올라가 자리를 잡을 때까지 모든 생활을 같이 했다. 정준재가 수비와 주루에서 어떤 장점과 단점을 가지고 있는지를 너무 잘 안다. 그렇기에 더 쉽게 대화가 통했을지 모른다. 손 코치와 정준재는 한참을 이야기하다 각자의 구역으로 향했다. 흔히 유망주들은 '세금'을 내야 한다고 말한다. 시작부터 완벽한 선수는 없다. 특히 KBO리그는 더 그렇다. 메이저리그는 특급 유망주의 경우 단계를 거쳐 기량을 완성시키고, 메이저리그에서 뛸 모든 준비를 마쳤다고 판단할 때 데뷔를 시킨다. 아무리 짧아도 1~2년이 걸리고, 길면 3~5년이 걸리는 경우도 있다. 대신 한 번 올라가면 확실하게 기회를 주고 고정을 시킨다. 그렇게 자유계약선수(FA) 자격까지 쭉 가는 경우가 많다. 반면 KBO리그는 선수층이 얇은 편이고, 신인부터 1군에서 뛰는 선수들이 많다. 정준재도 그런 선수다. 당연히 1군에서 실책도 하고, 플레이에서 미스를 하면서 많은 것을 배운다. 1군에서 전쟁을 치르면서 육성까지 하는 셈이다. 코치로서는 포탄이 날아다니는 전쟁터에서 신병을 교육하는 것이나 마찬가지다. 그래서 더 신중해야 한다. 선수의 기를 죽이지 않으면서도 실수를 되풀이하지 않도록 확실하게 교육해야 한다. 26일 경기 후 광경도 그 과정의 일환이었다. 사실 정준재는 빠르게 적응을 한 선수다. 그래서 대단하다. 지난해 1군 88경기에서 240타석을 소화하며 타율 0.307, 16도루를 기록했다. 선구안도 있고, 커트 능력도 있다. 미래의 리드오프 후보다. 다만 세밀한 플레이에서는 아직 완성된 선수가 아니다. 누구나 그렇듯이 시간이 걸린다. SSG도 세금은 각오한다. 다만 그 세금을 얼마나 현명하게 내느냐를 고민하고 있다. 1·2군 사이의 체계적인 매뉴얼 수립도 과제다. 정준재뿐만 아니라 박지환 고명준 조형우 이율예 등 야수들, 송영진 이로운을 위시한 젊은 투수들 모두가 마찬가지다. 지난해 포스트시즌 진출에는 실패했지만, 그래도 근래 들어 가장 많은 신예 선수들을 실험하면서 새 얼굴들이 많이 등장한 성과는 있었다. 성적을 포기할 팀이 아니라 어려움은 있겠지만 어차피 풀어가야 할 과제들이다. 새 얼굴들의 기량이 갈수록 나아지고 안정감을 찾아가면서 이것이 성적으로 이어질 수 있을지도 지켜볼 일이다. SSG는 반드시 그래야 올해 살 수 있다.",2025-03-27
"'내가 꽂히게 해줘'...이숭용 감독 바람 만족한 송영진 ""목표는 규정이닝·10승 달성""","선발 투수로 두 번째 시즌을 맞이하는 SSG 랜더스 우완 송영진(21)이 2025년 힘찬 첫 발을 내디뎠다. 송영진은 지난 26일 인천 SSG 랜더스필드에서 열린 2025 KBO리그 롯데 자이언츠와의 홈 주중 3연전 2차전에 선발 투수로 등판, 6과 3분의 1이닝 동안 6피안타 1볼넷 1실점으로 호투, SSG의 3-1 승리를 이끌고 시즌 첫 승을 거뒀다. 그는 특유의 무브먼트가 현란한 빠른 공으로 타자 히팅 포인트를 흔들었다. 마운드 위에서 완급을 조절하는 모습도 한층 능숙해졌다. 2023 신인 드래프트 2라운더(전체 15순위) 송영진은 지난 시즌 선발진에 합류, 총 20경기에서 선발 투수 임무를 수행했다. 6점 대 평균자책점을 남겼지만, 성장 가능성을 보여줬고 올해 스프링캠프에서도 기대주로 평가받았다. 올 시즌 첫 등판에서 연속 안타를 한 번밖에 허용하지 않았을 만큼 '쾌투'를 선보이며 올 시즌 기대감을 높였다. 그는 이날 개인 한 경기 최다 이닝도 경신했다. 송영진은 경기 뒤 ""이제 한 경기 치렀을 뿐이다. 오늘(26일 롯데전)을 발판 삼아 더 잘 던져야 한다""라고 했다. 개인 이닝 기록을 새로 쓴 점에 대해서도 ""경기에 집중하느라 크게 의식하지 않았다""라고 담담하게 말했다. 송영진은 7회도 마운드에 올랐지만, 선두 타자 나승엽에게 좌전 안타를 맞았다. 후속 전준우를 투수 앞 땅볼 처리한 뒤 대주자 장두성에 1루에 두고 마운드를 셋업맨 이로운에게 넘겼다. 송영진과 2023년 입단 동기이기도 한 이로운은 이어진 상황에서 전민재에게 병살타를 유도해 기출루자를 지웠다. 송영진은 ""(이)로운이가 잘 막아줘서 고맙게 생각하고 있다. 당연히 그럴 것이라고 믿고 있었다. 워낙 빨리 이닝을 마쳐서 그냥 안아주며 고마운 마음을 전했다""라며 웃었다. 송영진이 2025시즌 첫 등판부터 좋은 투구를 할 수 있었던 배경에 사령탑 이숭용 감독의 믿음도 있었다. 송영진은 지난 10일 한화 이글스와의 시범경기를 마친 뒤 이 감독으로부터 '내가 확 꽂힐 수 있는 모습을 보여달라'는 주문을 받은 뒤 ""정규시즌 때 보여주겠다""라는 다짐을 밝혔다고. 자신감이 떨어진 것 같은 모습을 보인 선수에게 사령탑이 동기를 부여한 것. 송영진은 ""오늘 잘 보일 수 있을 것 같아서 기분이 좋다""라고 했다. 이숭용 감독도 ""내가 원하는 그림""이었다고 만족했다. 그동안 송영진은 마운드 위에서 타자가 아닌 자신과 싸웠다고 자책했다. 이날 롯데전에선 1·2구 공략에 나서며 빠른 승부를 한 상대 타자들에게 더 공격적으로 나서 유리한 볼카운트를 잡아내며 한층 성숙한 모습을 보여줬다. 송영진의 올 시즌 목표는 규정이닝을 채우면서 10승을 달성하는 것이다. 그는 ""오늘(26일)만 즐기고, 내일부터 다시 다음 등판을 준비할 것""이라는 각오를 전했다. 안희수 기자 anheesoo@edaily.co.kr",2025-03-27
불펜 ERA 0.55…'휘몰아치는 김민 효과' 트레이드에 웃는 SSG,"오른손 투수 김민(26·SSG 랜더스)을 영입한 효과가 기대 이상이다. 이숭용 SSG 감독은 ""(김민이 합류하면서) 7~9회가 안정돼 확신을 갖고 투수 로테이션을 할 수 있다""며 ""(마운드 운영에서) 굉장히 큰 장점""이라고 흡족해했다. 기록이 말해준다. 26일 기준으로 SSG 불펜 평균자책점은 0.55(1위)에 불과하다. 16과 3분의 1이닝 1자책점. KBO리그 10개 구단 중 7개 구단의 불펜 평균자책점이 5점대 이상(리그 평균 5.78)이라는 걸 고려하면 SSG 불펜의 위력이 어느 정도인지 가늠할 수 있다. SSG의 지난 시즌 불펜 평균자책점은 리그 7위(5.25). 1년 만에 확 달라진 원동력 중 하나로 김민의 합류를 꼽을 수 있다. 지난해 10월 31일 트레이드로 영입한 김민은 필승조에 가세했다. 선발 경험이 있는 불펜이라는 점에서 선발 로테이션 합류 가능성도 예상됐는데 이숭용 감독의 결정은 불펜이었다. 선발로 보직을 바꾼 문승원의 빈자리를 채우면서 홀드왕 출신 노경은과 함께 주로 7~8회를 막는 중책을 맡겼다. 이 감독은 ""(마무리 투수) 조병현과 노경은, 김민까지 3명은 다른 팀과 견줘도 뒤지지 않는다""라고 신뢰했다. 지난 26일 인천 롯데 자이언츠전에선 김민의 합류 효과가 여실히 드러났다. 7회부터 불펜을 가동한 SSG는 2-1로 앞선 8회 김민을 마운드에 세웠다. 결과는 1이닝 무실점. 이어 9회 노경은이 배턴을 이어받아 1이닝 무실점 세이브를 기록했다. 전날 조병현의 투구 수(27개)가 다소 많아 이날 등판이 쉽지 않았는데 김민과 노경은이 아웃카운트 6개를 합작하며 살얼음 리드를 지켜냈다. SSG는 김민을 영입하는 과정에서 왼손 투수 오원석을 KT 위즈에 내줬다. 오원석이 선발로 육성한 1차 지명 유망주라는 점에서 트레이드 결과에 따라 후폭풍이 거셀 수 있었다. 그만큼 부담이 큰 결정이었는데 출발은 산뜻하다. 부상에서 회복한 서진용의 구위가 아직 올라오지 않아 김민의 존재감이 더욱 부각된다. 이숭용 감독은 ""불펜은 많을수록 좋다. 올 시즌에는 (마운드 사정상) 불펜 야구를 해야지 않을까 생각한다""며 ""(김민을 비롯한 선수들이) 최대한 과부하가 걸리지 않는 방법을 찾아야 해서 다양하게 고민 중""이라고 말했다. 배중현 기자 bjh1025@edaily.co.kr",2025-03-27
"김민 합류·이로운 성장·노경은 건재…SSG, 불펜 ERA 0.55","(서울=연합뉴스) 하남직 기자 = 한국프로야구 2025 KBO리그가 개막해 4경기를 치르는 동안 SSG 랜더스 투수진은 평균자책점(ERA) 2.37로, 1.00의 LG 트윈스에 이어 2위에 올랐다. 투수진의 호투 덕에 SSG는 3승 1패로 기분 좋게 시즌을 시작했다. 26일까지 치른 4경기 모두 3점 차 이내의 접전이었다. SSG는 한결 탄탄해진 불펜진 덕에 뒤로 갈수록 힘을 냈다. 26일 현재 SSG의 불펜 평균자책점은 0.55(16⅓이닝 15피안타 2실점 1자책)로 1위다. 2위 kt wiz(2.45)와도 격차가 크다. 이숭용 SSG 감독은 올 시즌을 시작하며 ""불펜에서 믿고 맡길 투수가 늘었다""고 말했다. 실제로 선발과 마무리 조병현 사이에 김민, 노경은, 이로운, 한두솔이 등판해 상대 타선을 막았다. 올 시즌 SSG 불펜 중 실점한 선수는 시즌 첫 등판의 부담을 극복하지 못한 김건우(1실점)와 마무리 조병현(1실점 비자책)뿐이다. 지난해 홀드왕 노경은이 건재하고, 이로운, 한두솔은 성장했으며, 새로 영입한 김민은 이미 불펜진의 주축으로 자리매김했다. 노경은은 4경기에 모두 등판해 1세이브 1홀드를 올렸다. 불혹에도 믿음직한 투구를 이어가고 있다. 지난해 63경기에 등판해 1승 3패, 1세이브, 9홀드, 평균자책점 5.95로 기대에 미치지 못한 성적표를 받은 고졸 3년 차 이로운은 올해 3경기에서 3이닝 1피안타 무실점으로 호투 중이다. 올해 이로운은 필승조로 편입됐다. SSG의 왼손 필승 불펜은 한두솔이다. 한두솔은 25일 롯데 자이언츠와 경기에서는 ⅓이닝 동안 3안타를 내주며 고전했지만, 실점은 하지 않았다 한두솔도 3경기 2이닝 무실점 행진을 이어가고 있다. 한두솔이 25일 롯데전에서 1사 만루에 처했을 때, 마운드를 이어받은 김민은 윤동희를 유격수 앞 병살타로 요리하며 실점 없이 이닝을 끝냈다. SSG는 지난해 10월 31일 왼손 선발 요원 오원석을 kt에 내주고 김민을 영입했다. 김민은 올해 4경기에 모두 등판해 3⅔이닝 4피안타 무실점으로 잘 던지며 홀드 2개를 올렸다. 김민이 불펜 필승조에 가세하면서, SSG에 경기 후반 믿고 쓸 카드가 한 장 늘었다. 지난해 SSG의 불펜 평균자책점은 5.25로 10개 구단 중 7위였다. 이숭용 감독은 ""올해 우리 필승조는 다른 팀에 밀리지 않는다""고 자신했다. 시즌 초반 4경기에서 SSG는 필승조의 힘을 확인했다. jiks79@yna.co.kr",2025-03-27
