news_title,news_content,published_date
"'4⅓이닝 7K 노히터' 김건우가 SSG 구했다-통산 첫 승 감격, 롯데 꺾고 4승 1패 고공행진... 최지훈 결승 3루타 작렬 [인천 현장리뷰]","[스타뉴스 | 인천=안호근 기자] 1+1으로 나선 김건우(23)가 SSG 랜더스의 영웅이 됐다. 100점짜리 노히트 피칭으로 SSG에 소중한 1승을 안겼다. 2021년 1차 지명 투수인 김건우는 감격의 데뷔 첫 승리의 감격까지 누렸다. SSG는 27일 인천 SSG랜더스필드에서 열린 롯데 자이언츠와 2025 신한 SOL뱅크 KBO리그 홈경기에서 5-2로 이겼다. 이로써 개막 후 5경기에서 4승 1패를 이어간 SSG는 5연승을 달린 LG 트윈스에 이어 2위 자리를 지켰다. 반면 롯데는 1승 5패로 한화 이글스와 함께 공동 최하위를 벗어나지 못했다. SSG는 이날 최지훈(중견수)-정준재(2루수)-박성한(유격수)-기예르모 에레디아(좌익수)-한유섬(지명타자)-하재훈(우익수)-고명준(1루수)-박지환(3루수)-조형우(포수)로 선발 라인업을 꾸렸다. 투수는 5선발 마지막 자리에 도전하는 박종훈. 롯데는 윤동희(중견수)-정훈(지명타자)-나승엽(1루수)-빅터 레이예스(우익수)-전준우(좌익수)-손호영(3루수)-박승욱(유격수)-전민재(2루수)-정보근(포수)로 맞섰다. 선발은 나균안을 내세웠다. 양 팀 모두 선발 투수에 거는 기대가 컸다. SSG는 외국인 투수 미치 화이트가 빠진 가운데서도 드류 앤더슨-김광현-문승원-송영진이 안정적인 선발진을 구축하며 3승 1패로 상승세를 달렸다. 선발진의 마지막 퍼즐을 박종훈이 메워줄 차례였다. 경기 전 이숭용 SSG 감독은 ""선발이니 상황을 봐야 한다. 그 뒤에 (김)건우, (정)동윤이가 준비를 하고 있다. 아마 종훈이가 좋은 피칭을 보여줄 것이라고 기대하고 있다""고 믿음을 보였다. 롯데 또한 ""예상을 할 순 없다. 상상은 늘 한다. 예상은 할 수 없고 (나)균안이가 7회까지 1실점만 하는 상상을 한다""면서 ""이닝 수를 어느 정도 가져가느냐, 점수를 주는 건 어쩔 수 없겠지만 그만큼 안 흔들리고 자기 페이스를 유지해서 가는 게 가장 중요할 것 같다""고 말했다. 박종훈은 불안한 투구를 이어갔다. 1회부터 윤동희와 정훈에게 연속 볼넷을 내주며 시작했지만 실점 없이 이닝을 마쳤다. 2회에도 몸에 맞는 공으로 선두 타자를 내보냈고 3회에도 연속 볼넷으로 이닝을 열더니 나승엽의 땅볼 타구 때 진루, 레이예스의 중견수 플라이 때 홈을 밟았다. 나균안은 3회까지 퍼펙트 피칭을 펼쳤다. 롯데는 박종훈을 상대로 박승욱이 몸에 맞는 공으로 출루해 도루 성공 이후 정보근의 안타 때 선취점을 뽑아냈다. 박종훈은 4회를 채우지 못하고 마운드에서 물러났다. 김건우가 공을 넘겨받았다. 사실상 1+1의 개념이었다. SSG 타선도 응수했다. 타자가 일순한 뒤 4회 다시 나균안을 맞이한 최지훈이 안타를 날렸고 박성한은 볼넷, 에레디아가 동점 적시타를 날렸다. 이어 시즌 초반 극심한 부진을 겪던 한유섬이 짜릿한 역전 적시타를 날렸다. SSG의 공세는 이어졌다. 5회 선두 타자 박지환이 내야 안타, 최지훈과 박성한이 볼넷으로 2사 만루 기회를 만들었다. 결국 나균안도 5이닝까지 아웃카운트 하나를 남겨두고 강판됐다. 김강현에게 공을 넘겼고 에레디아를 삼진으로 돌려세워 한숨을 돌렸다. 4회초 2사에 마운드에 오른 김건우가 완벽한 피칭을 펼쳤다. 5,6,7회 단 한 타자에게도 출루를 허용하지 않고 삼진을 무려 6개나 잡아냈다.
8회에도 마운드에 오른 김건우는 나승엽에게 몸에 맞는 공을 내주고도 레이예스에게 2루수 방면 땅볼 타구를 유도해 병살타로 주자를 지워냈다. 전준우는 낮게 떨어지는 체인지업으로 헛스윙 삼진으로 돌려세웠다. 기회를 살리지 못하던 SSG 타선은 7회말 폭발했다. 선두 타자 조형우의 중전 안타로 시작한 SSG는 최지훈의 역전 1타점 3루타에 이어 정준재의 내야 안타에 이은 박성한의 추가 1타점 적시타, 에레디아의 쐐기 적시타로 5-2로 앞서갔다. 9회엔 든든한 마무리 조병현이 등판했다. 1사에서 볼넷과 안타를 맞고 흔들렸지만 정보근을 병살타로 돌려세우며 세이브를 수확했다. 김건우는 4회 2사에서 등판해 4⅓이닝 동안 65구를 던져 피안타 없이 2사사구 7탈삼진 완벽한 투구로 승리를 챙겼다. 조병현은 시즌 2번째 세이브를 수확했다. 반면 롯데 나균안은 4⅔이닝 동안 86구 4피안타 3사사구 6탈삼진 2실점하며 아쉬움을 남겼다.",2025-03-27
"SSG 4선발 찾았다! 사령탑도 함박웃음 ""송영진, 팍팍 꽂히더라…달라지겠단 약속 지켰어""","(엑스포츠뉴스 문학, 김근한 기자) SSG 랜더스 투수 송영진이 4선발로 완벽하게 자리 잡을까. 시즌 첫 등판에서 쾌투를 펼친 송영진을 두고 SSG 이숭용 감독은 함박웃음을 지었다. 송영진은 지난 26일 인천 문학SSG랜더스필드에서 열린 2025 신한 Sol 뱅크 KBO리그 롯데 자이언츠전에 선발 등판해 6.1이닝 6피안타 6탈삼진 1볼넷 1실점으로 팀의 3-1 승리에 이바지했다. 송영진은 1회 초 선두타자 황성빈에게 첫 안타를 맞았지만, 나머지 세 타자를 모두 범타 처리했다. 2회 초 첫 삼자범퇴 이닝을 만든 송영진은 3회 초 세 타자를 모두 삼진으로 돌려세우는 괴력을 발휘했다. 송영진은 4회 초 1사 1루 상황에서 레이예스를 병살타로 유도해 이닝을 끝냈다. 5회 초는 위기였다. 송영진은 5회 초 1사 뒤 전준우와 전민재에게 안타를 내줬다. 후속타자 박승욱을 삼진으로 잡았지만, 송영진은 정보근에게 적시타를 맞고 2-1 한 점 차 추격을 허용했다. 이어진 2사 1, 3루 위기에서는 황성빈을 1루 땅볼로 잡고 추가 실점을 막았다. 송영진은 6회 초를 삼자범퇴로 다시 넘기면서 퀄리티 스타트를 달성했다. 7회 초 마운드에도 오른 송영진은 선두타자 나승엽에게 안타를 맞았지만, 전준우를 땅볼로 잡고 공을 이로운에게 넘겼다. 이로운과 김민, 그리고 노경은으로 이어진 SSG 불펜진은 3-1 두 점 차 리드를 유지하면서 송영진의 첫 승까지 지켰다. 이숭용 감독은 27일 경기 전 취재진과 만나 ""오늘은 어제 던진 불펜 투수 3명이 모두 쉰다. 개막 뒤 4경기 모두 타이트했는데 불펜진이 너무 잘 막아줬다. 타격이 살짝 그래도 선발진과 불펜진 덕분에 3승 1패를 거뒀다""며 ""송영진 선수도 어제 완벽한 투구를 선보였다. 이제는 자기보다는 상대와 싸우는 느낌이 든다. 시범경기 때 자극을 줬는데 정규시즌에 들어가면 달라지겠다고 얘기했다. 그 약속을 지켰다""라며 기뻐했다. 이어 이 감독은 ""어제 송영진의 공이 팍팍 꽂혔다. 그동안 나온 한 번에 무너지는 그림이 아니라 안타를 맞아도 자기 투구를 하더라. 우리가 원하는 그림이 나왔다. 경쟁에서 이겼고, 시범경기에서 애를 태우더니 어제 완전히 다른 사람이 됐다. 준비를 착실히 잘한 만큼 어린 친구들이 이렇게 올라오면 팀이 더 탄탄해질 수 있다""라며 고갤 끄덕였다. 사진=SSG 랜더스",2025-03-27
"1경기 1타석 1볼넷 기록하고 2군행…감독은 ""미안하다, 마음이 아팠다"" [IS 인천]","이숭용 SSG 랜더스 감독이 2군으로 내려간 선수의 마음을 헤아렸다. 이숭용 감독은 27일 인천 롯데 자이언츠전에 앞서 이날 경기에 선발 등판하는 언더핸드스로 박종훈(34)을 1군에 등록, 그의 자리를 마련하기 위해 내야수 최준우(26)를 2군으로 내렸다. 이로써 개막 엔트리에 포함됐던 최준우는 1경기 1타석 1볼넷의 기록만 남기고 1군 엔트리에서 이름이 지워졌다. 점수 차이가 타이트한 경기가 반복되면서 별다른 출전 기회를 잡지 못했다. 이숭용 감독은 ""마음이 너무 아팠다. 어제저녁에 불러서 '미안하다'라고 얘기했다""며 ""기회를 주고 해보고 싶었는데 (그러지 못한) 상황을 잘 설명했다. 준비 잘하고 있으면 기회를 주겠다고 했는데 얘기할 때 좀 마음이 그랬다""라고 말했다. 구단 관계자에 따르면 최준우는 지난 시즌을 마친 뒤 일본 가고시마 마무리 캠프부터 외야 수비를 병행했다. 출전 시간을 늘리기 위해 부단히 노력했으나 결실을 이루지 못했다. 장충고를 졸업한 최준우는 2018년 SK 와이번스(현 SSG)에 입단, 내야 유망주로 기대를 모았다. 2군 통산 타율이 0.323에 이를 정도로 타격이 강점. 2023년에는 36경기 타율 0.369(122타수 45안타)를 기록하기도 했다. 이숭용 감독은 ""누구보다 열심히 준비했고 외야 수비도, 공격도 많이 늘었다. 감독이기 전에 야구 선배로서 미안하더라""며 ""(다만 그런 감독을 뒤로하고) 수장으로서 팀 전체를 봐야 한다""라고 메시지를 전했다. 한편 이날 SSG는 최지훈(중견수) 정준재(2루수) 박성한(유격수) 에레디아(좌익수) 한유섬(지명타자) 하재훈(우익수) 고명준(1루수) 박지환(3루수) 조형우(포수) 순으로 선발 출전한다. 타격감이 좋지 않은 한유섬이 라인업에 복귀하고 주전 안방마님 이지영이 빠졌다. 선발 투수는 언더핸드스로 박종훈이다. 인천=배중현 기자 bjh1025@edaily.co.kr",2025-03-27
"'4연투' 필승조 3명 다 쉰다! 1선발도, 4번타자도 없는 SSG의 여유 ""다른 투수들이 힘내주길"" [인천포커스]","[인천=스포츠조선 김영록 기자] 에이스도, 간판타자도 없지만 시즌초 3승1패. 사령탑의 표정에는 만족스런 미소가 번졌다. 27일 인천 SSG랜더스필드에서 만난 이숭용 SSG 감독은 ""오늘은 필승조 3명이 다 쉰다""고 했다. SSG의 필승조는 이로운-김민-노경은이다. 김민과 노경은은 올시즌 두산 베어스-롯데 자이언츠와의 4경기에 모두 등판했다. 이로운은 3경기(롯데전 2연투) 등판을 소화했다. 이숭용 감독은 ""최민준이 있고, (마무리)조병현도 출격 가능하다. 매경기 타이트한 경기를 하다보니 고생이 많았는데, 필승조 3명은 오늘 푹 쉬게 했다""고 설명했다. 막강 불펜 덕분에 시즌초 3승1패를 기록중이다. 투타의 핵심 미치 화이트-최정이 모두 빠진 상황에서 기분좋은 출발이다. 선발진의 분위기도 좋다. 김광현 문승원 송영진까지 좋은 모습을 보이면서 당초 1+1으로 붙일 예정이던 5선발 후보 김건우와 정동윤은 고스란히 휴식을 취했다. 때문에 이날 경기는 이들을 활용해 치루겠다는 게 사령탑의 계획이다. 전날 6⅓이닝 1실점 6K로 호투한 선발 송영진에 대해서는 ""거의 완벽했다. 보고 있는 내내 흐뭇했다. 전에는 자기 자신과 싸우는 느낌이었는데, 이젠 좀 달라졌다. 그 모습만 봐도 발전했다는 생각이 든다""면서 ""시범경기에 부진해서 계속 핀잔을 줬는데, 자극이 됐는지 열심히 하더라. '정규시즌엔 달라질 겁니다' 하더니 자기 말을 지켰다""고 찬사를 보냈다. ""지난해 박종훈에서 송영진으로 선발을 바꾼 이유가 올시즌을 생각한 것이기도 했다. 경쟁을 이겨냈고, 이렇게 잘해주면 감독은 뿌듯하다. 3년차가 되면서 이제 기량이 업그레이드됐다고 본다. 준비를 잘한 만큼 팀이 탄탄해지는 거라고 생각한다.""",2025-03-27
"개인 최고 6⅓이닝 1실점 괴력투, 이숭용 감독 ""완벽했다, 팍팍 꽂혔다"" [IS 인천]","이숭용 SSG 랜더스 감독이 송영진(21)의 올 시즌 첫 등판을 두고 한 말이다. 송영진은 지난 26일 인천 롯데 자이언츠전에 선발 등판, 6과 3분의 1이닝 6피안타 6탈삼진 1실점하며 승리를 따냈다. 아웃카운트 19개를 책임진 건 2023년 데뷔 후 개인 한 경기 최다(종전 6이닝 5회). 이숭용 감독은 ""보고 있는 내내 흐뭇했다. 예전에는 자기하고 싸우는 느낌이었는데 지금은 상대하고 싸우는 느낌이 들더라. 조금 발전하지 않았나 생각한다""라고 말했다. 대전고를 졸업한 송영진은 2023년 신인 드래프트 2라운드 전체 15순위로 지명된 유망주. 지난 시즌에는 5승 10패 평균자책점 5.80을 기록했다. 선발 투수로 기회를 꾸준히 받았으나 성장세가 눈에 띄는 건 아니었다. 올해 시범경기 성적은 1경기 3이닝 5피안타 3실점 했다. 이숭용 감독은 ""게임(정규시즌)에 들어가면 달라질 거라고 잘하겠다고 했는데 말을 지켰다""며 ""(피칭이 가슴에) 팍팍 꽂혔다. 우리가 원하는 그림이었는데 너무 잘 던졌다""라고 흡족해했다. 롯데전 송영진의 투구 수는 83개(스트라이크 56개). 직구(39개)와 커브(20개) 슬라이더(21개) 포크(3개)를 다양하게 섞었다. 개막 4선발로 낙점한 코칭스태프의 기대대로 지난 시즌과 180도 다른 모습이었다. 완급조절(사사구 1개)도 흠잡을 곳이 없었다. 이숭용 감독은 ""지난해 (박)종훈이가 선발로 들어갔다가 안 되면서 영진이로 (선발 투수를) 바꾼 것도 올 시즌을 생각했기 때문이다. 경쟁을 시켰는데 본인이 이겨냈다""며 ""시범경기 내내 애를 태우더니 게임 들어가서 완전히 다른 사람이 됐다. 감독으로선 뿌듯하다""라고 말했다. 이어 이 감독은 ""본인들이 착실하게 준비를 잘했다""며 ""(투구하다가) 한 번에 무너지는 게 있었는데 어제는 안타 맞고 주자가 있어도 자기 피칭을 하더라. 더 좋아지겠구나 그런 생각을 했다""라고 기대를 내비쳤다. 한편 이날 SSG는 최지훈(중견수) 정준재(2루수) 박성한(유격수) 에레디아(좌익수) 한유섬(지명타자) 하재훈(우익수) 고명준(1루수) 박지환(3루수) 조형우(포수) 순으로 선발 출전한다. 타격감이 좋지 않은 한유섬이 라인업에 복귀하고 주전 안방마님 이지영이 빠졌다. 선발 투수는 언더핸드스로 박종훈이다. 인천=배중현 기자 bjh1025@edaily.co.kr",2025-03-27
"""3루는 20살-2루 22살-1루 23살인데"" 사령탑도 놀란 SSG의 반전, 최정-외인 없어도 공동 2위라니 [인천 현장]","[스타뉴스 | 인천=안호근 기자] ""우리 팀이 5강 안에 없지 않겠나, 그건 팩트다."" 불과 2개월 전 스프링캠프를 떠나기 전까지만 해도 이숭용(54) SSG 감독은 팀 전력에 대해 냉정하게 평가했다. '팀 리모델링'을 모토로 젊은 선수들의 성장에 더욱 기대를 걸어야 하는 상황에서 어느 정도 납득이 가는 말이었다. 그러나 시즌 초반 SSG는 사령탑의 평가가 틀렸다는 걸 증명이라도 하듯 질주하고 있다. 3승 1패로 현재 LG 트윈스(4전 전승)에 이어 공동 2위를 달리고 있다. 더 고무적인 건 KBO리그 통산 최다 홈런의 주인공 최정(38)과 외국인 투수 미치 화이트(31)가 부상으로 전력에 합류하지도 못한 상황에서 거둔 성과라는 것이다. 이숭용 감독은 27일 인천 SSG랜더스필드에서 롯데 자이언츠와 2025 신한 SOL뱅크 KBO리그 홈경기를 앞두고 취재진과 만나 ""솔직히 걱정을 안 하진 않았다. 그런데 야구라는 스포츠가 누구 하나에 좌우되는 것은 아니지만 순번이 있지 않나. 타순이라는 게 있고 비중이 굉장히 큰 선수들인데 선수들이 똘똘 뭉쳐서 긍정적으로 생각하는 계기가 됐다""며 ""모든 구성원들이 열심히 준비한 게 나오고 있다. (최)정이나 화이트가 돌아오면 좀 더 편하게 가지 않을까 생각한다""고 말했다. 시즌 극초반이기는 하지만 '팀 리모델링'이라는 방향성과 성적 두 마리 토끼를 동시에 잡고 있다. 이 감독도 예상치 못한 결과였다. ""개막 전에 솔직히 라인업을 보고 저도 의아했다. 3루(박지환)는 20살, 2루(정준재)는 22살, 1루(고명준)는 23살이더라. 속으로 제 자신에게 '어차피 리모델링을 해야 하니까 준비 잘해서 선수들 믿고 쓰자'라는 생각을 했는데 실수도 있지만 주눅 들지 않고 자기 역할을 열심히 하고 있는 걸 알고 있기에 중고참들이 더 힘을 내주지 않나 이런 생각이 든다""고 만족스러워 했다. 선발진도 화이트 없이도 만족스러운 투구를 펼치고 있다. 1선발 드류 앤더슨이 개막전 4이닝도 못 채우고 강판됐지만 이후 김광현(5⅔이닝 2실점), 문승원(6이닝 2실점)에 이어 송영진(6⅓이닝 1실점)까지 안정적인 투구를 펼쳤다. 이날은 박종훈이 등판한다. 선발진의 마지막 퍼즐이 될 수 있는 카드다. 이 감독은 ""선발이니 상황을 봐야 한다. 그 뒤에 (김)건우, (정)동윤이가 준비를 하고 있다. 아마 종훈이가 좋은 피칭을 보여줄 것이라고 기대하고 있다""고 믿음을 보였다. 부상자들도 이제 복귀를 준비 중이다. 화이트는 28일 불펜 피칭을 통해 40구 정도를 던지며 몸 상태를 체크할 예정이다. 최정 또한 복귀를 앞두고 몸 상태를 끌어올리고 있다. 이 감독은 ""(화이트는) 점점 좋아지고 있다는 얘기를 하고 있다""며 ""(정이도) 계속 몸을 조금씩 움직일 수 있게 만들고 있다. 최종적으로는 31일 재검진 결과를 봐야 될 것 같다""고 설명했다.",2025-03-27
“개막하면 달라질 겁니다” SSG 송영진은 약속을 지켰다…만족한 이숭용 감독 “완벽했다”[스경X현장],이숭용 SSG 감독은 송영진 이름 석자만 들어도 흐뭇한지 미소를 지었다. 이숭용 감독은 27일 인천SSG랜더스필드에서 열린 롯데와의 경기를 앞두고 “거의 완벽했다. 보는 내내 흐뭇했다”라고 말했다. 송영진은 전날 롯데전에서 선발 등판해 6.1이닝 1볼넷 6삼진 1실점으로 호투해 팀의 3-1 승리를 이끌었다. SSG는 전날 패배를 설욕한 것은 물론 4선발 송영진의 호투라는 수확까지 얻었다. 송영진은 2023년 SSG에 입단해 데뷔 시즌부터 선발과 불펜을 오갔던 투수다. 지난해에는 중간 계투로 시즌을 시작했다가 5월부터는 선발 로테이션을 소화하며 경험을 쌓았다. 지난 시즌 성적은26경기 5승10패 평균자책 5.80이었다. 올해에는 4선발로 낙점을 받았지만 시범경기에서는 큰 믿음을 주지 못했다. 지난 10일 한화와의 시범경기에서 3이닝 5안타 1볼넷 1사구 2삼진 3실점으로 흔들렸다. 사령탑은 송영진이 강점인 직구를 자신있게 꽂기를 바랐다. 다행히 개막 후에는 바라던 모습을 볼 수 있었다. 이 감독은 “예전에는 자기 자신과 싸우는 느낌이었다. 그런데 이제는 상대와 싸우는 느낌이 들었다. 그런 모습을 보면 조금 발전하지 않았나라는 생각이 들더라”고 말했다. 시범 경기 내내 생각을 주입 시킨 덕분이다. 이 감독은 “시범 경기 기간 동안 이야기를 했는데 자극이 됐는지 열심히 했다. 영진이도 ‘경기 들어가면 달라질 겁니다. 잘 하겠습니다’라고 했다. 그런데 진짜 말한 걸 지켰다”고 했다. 지난 시즌부터 송영진의 이런 모습을 바랐다. 이 감독은 “지난해 박종훈이 선발로 들어갔다가 안 되면서 송영진으로 바꾼 것도 올시즌을 생각한 것도 있었다”며 “그래서 경쟁을 시켰고 본인이 이겨냈다. 시범경기에서는 애를 태우더니 개막 후에는 완전히 다른 사람이 되어 던져서 감독으로서는 되게 뿌듯하다”라고 말했다. 프로 3년차로서 경험이 쌓인 덕분이라고 봤다. 이 감독은 “3년 차가 되면 업그레이드가 된다고 본다”며 “또 본인들이 준비를 충실하게 잘 했다.어린 친구들이 올라오면 올라올수록 우리는 더 탄탄하게 갈 수 있으니까 기분이 좋았다”라며 거듭 칭찬했다. 앞으로 더 좋아질 수 있다는 희망도 봤다. 이 감독은 “예전에는 한 번에 무너지는게 있었는데 안타를 맞아도 자기 피칭을 하는 거 보고 더 좋아지겠구나라고 생각이 들더라”고 말했다. 인천 | 김하진 기자 hjkim@kyunghyang.com,2025-03-27
"'이럴 수가' 외야 겸업도 했는데 1타석 뒤 충격 2군행→""마음 너무 아파, 어제 미안하다고 말했어"" [문학 현장]","(엑스포츠뉴스 문학, 김근한 기자) SSG 랜더스 내외야 멀티 플레이어 최준우가 2군으로 내려갔다. 외야 겸업까지 하면서 개막 엔트리 생존에 성공했지만, 최준우에게 주어진 타석은 단 한 타석뿐이었다. SSG 이숭용 감독도 최준우를 향한 미안함을 감추지 못했다. SSG는 27일 인천 SSG랜더스필드에서 2025 신한 Sol 뱅크 KBO리그 롯데 자이언츠전을 치른다. 전날 SSG는 선발 투수 송영진의 6.1이닝 6피안타 6탈삼진 1볼넷 1실점 쾌투와 1회 말 최지훈의 결승 솔로 홈런을 앞세워 롯데를 3-1로 꺾었다. 불펜진에선 이로운(0.2이닝)-김민(1이닝)-노경은(1이닝)으로 이어지는 철벽 릴레이 계투가 이어졌다. 이숭용 감독은 27일 경기 전 취재진과 만나 ""오늘은 어제 던진 불펜 투수 3명이 모두 쉰다. 개막 뒤 4경기 모두 타이트했는데 불펜진이 너무 잘 막아줬다. 타격이 살짝 그래도 선발진과 불펜진 덕분에 3승 1패를 거뒀다""며 ""송영진 선수도 어제 완벽한 투구를 선보였다. 이제는 자기보다는 상대와 싸우는 느낌이 든다. 시범경기 때 자극을 줬는데 정규시즌에 들어가면 달라지겠다고 얘기했다. 그 약속을 지켰다""라고 전했다. SSG는 27일 롯데전에서 최지훈(중견수)-정준재(2루수)-박성한(유격수)-에레디아(좌익수)-한유섬(지명타자)-하재훈(우익수)-고명준(1루수)-박지환(3루수)-조형우(포수)로 이어지는 선발 타순을 앞세워 롯데 선발 투수 나균안과 상대한다. SSG 선발 마운드엔 베테랑 잠수함 박종훈이 올라간다. SSG는 박종훈 등록을 위해 최준우를 말소했다. 최준우는 상무야구단 제대 뒤 좀처럼 1군에 제대로 자리 잡지 못했다. 2023시즌 38경기 출전에 머물렀던 최준우는 2024시즌 18경기 출전으로 더 입지가 좁아졌다. 시범경기 당시 최준우는 ""돌이키면 자신감이 많이 부족했다. 위축된 상태에서 소극적인 플레이를 자주 했다. 올해는 정말 실수를 하더라도 자신 있는 플레이로 기회를 놓치고 싶지 않다""며 ""나에게는 시범경기가 정규시즌이나 다름 없다. 정규시즌에도 살아남아 팀에 힘을 보탤 수 있도록 계속 잘 준비하겠다""라고 다짐했다. 최준우는 시범경기 6경기에 출전해 타율 0.333, 3안타, 1홈런, 3타점, 3볼넷 호성적을 거두면서 개막 엔트리에서 생존했다. 하지만, 최준우는 지난 23일 문학 두산 베어스전에서 단 한 타석(볼넷)만 소화한 뒤 2군으로 내려갔다. 이 감독은 ""최준우 선수를 내리면서 마음이 너무 아팠다. 그래서 어제 불러서 저녁에 미안하다고 얘기했다. 기회를 진짜 주고 싶었지만, 팀 상황을 설명했다. 밑에서 잘하고 있으면 꼭 다시 기회를 주겠다고 약속했다""며 ""누구보다 열심히 준비한 선수다. 외야 수비와 타격까지 크게 성장했는데 미안하더라. 감독이기 전에 야구 선배로서도 조금 그랬다. 팀을 전체적으로 봐야 해서 불가피한 결단이었다""고 안타까움을 내비쳤다. 한편, 햄스트링 부상으로 빠졌던 외국인 투수 미치 화이트는 오는 28일 불펜 투구를 할 예정이다. 이 감독은 ""화이트는 내일 40구 정도 불펜 투구를 소화할 계획이다. 점점 좋아지고 있다. 최정 선수도 계속 몸을 움직이면서 만들고 있다. 오는 31일에 최종 검진 결과를 봐야 한다""라고 밝혔다. 사진=엑스포츠뉴스 DB/SSG 랜더스",2025-03-27
